Mary, the famous forensic psychologist and writer, was inspired by Tatoeba to write a novel about Tom, the serial killer from Boston.	Mary, famosa psicóloga forense e escritora, inspirou-se em Tatoeba para escrever um romance sobre Tom, o assassino em série de Boston.
Not that there's anything wrong with that.	Não que tenha algo de errado com isso.
Did you really talk to him?	Realmente falaste com ele?
I want to stay as long as I can.	Eu quero ficar enquanto puder.
Why don't you have a girlfriend?	Por que você não tem namorada?
Tom is an old man.	Tom é um velho.
The cat likes mice; I don’t like them.	O gato gosta de ratos; eu não gosto deles.
I do not believe in the God of theology who rewards good and punishes evil.	Eu não acredito no Deus da teologia, que recompensa o bem e pune o mal.
He would let me help him.	Ele me deixaria ajudá-lo.
You're Tom's students, aren't you?	Você é aluno de Tom, não é?
Tom is filthy.	Tom está imundo.
Do you know what Tom did yesterday?	Você sabe o que o Tom fez ontem?
Let's not talk about that right now.	Não vamos falar sobre isso agora.
Tom wasn't sitting on the steps.	Tom não estava sentado nos degraus.
It's not at all uncommon. In fact, it's very common.	Não é nada incomum. Na verdade, é muito comum.
I know a very nice place to drink.	Eu conheço um lugar muito bom para beber.
When will you retire?	Quando você se aposenta?
We've located Tom.	Localizamos o Tom.
Have you ever been a teacher?	Tu já foste professora?
The world needs more affections.	O mundo precisa de mais afeto.
There are other options.	Há outras opções.
Atomic nuclei are small magnets with a north pole and a south pole.	Os núcleos atômicos são pequenos ímãs com polo norte e polo sul.
We had a fight.	Nós tivemos uma briga.
Do you like it? I like it.	Você gosta? Eu gosto.
If you keep creeping along like a turtle, we'll never reach the goal.	Se você continuar se rastejando como uma tartaruga, nunca alcançará o objetivo.
I don't want to keep Tom waiting.	Não quero deixar Tom esperando.
She is so heartless.	Ela é tão desalmada.
I felt cold.	Eu fiquei com frio.
Why do you always do that to me?	Por que você sempre faz isso comigo?
Can you speak Japanese?	Você sabe falar japonês?
The aim of art is to represent not the outward appearance of things, but their inward significance.	O objetivo da arte é representar não a aparência externa das coisas, mas seu significado íntimo.
Did you know that Tom had left town?	Você sabia que Tom tinha deixado a cidade?
I'm in my pajamas.	Eu estou de pijamas.
I caught two fish.	Eu peguei dois peixes.
I know that you believe that you understood what you think I said, but I am not sure you realize that what you heard is not what I meant.	Eu sei que você acredita que você entendeu o que você acha que eu disse, mas eu não tenho certeza se você percebe que o que você ouviu não é o que eu quis dizer.
Tom loved Mary, who didn't love him at all.	Tom amava Maria, que, de fato, não o amava.
Tom broke his right arm.	Tom quebrou o braço direito.
I hate people who talk like that.	Detesto pessoas que falam desse jeito.
I approve of your plan.	Estou de acordo com teu plano.
And yet it moves!	E ainda por cima ele se mexe!
If you like it then get ready!	Se você gosta dele, então se pronto!
I bought this car from Tom.	Eu comprei esse carro do Tom.
Tom will be glad to see you.	Tom ficará muito feliz em ver vocês.
Sit down!	Assente-se!
Tom wanted to thank you.	Tom queria te agradecer.
She gets 5% of my gains.	Ela recebe 5% dos meus ganhos.
Most of the plants died.	A maioria das plantas morreu.
Kyoto was an old capital of Japan.	Quioto era uma velha capital do Japão.
It was an accident.	Foi um acidente.
Tom is looking up into the sky.	Tom está olhando para o céu.
My father is an electric engineer.	O meu pai é engenheiro eletricista.
There were ten of us.	Éramos dez pessoas.
We're efficient.	A gente é eficiente.
Those are Tom's shoes.	Esses são os sapatos do Tom.
I'm waiting for a friend.	Eu estou esperando uma amiga.
I wrote down his phone number so I wouldn't forget it.	Escrevi o número de telefone dele no papel para não me esquecer.
You need good equipment to climb that mountain.	Você precisa de um bom equipamento para escalar aquela montanha.
He's going blind.	Está ficando cego.
I think you did it.	Acho que você fez isso.
I can't believe I'm here again.	Eu não posso acreditar que estou aqui novamente
Will you be driving to Boston by yourself?	Você mesmo vai dirigir até Boston?
How many pictures do you need?	De quantas fotos o senhor precisa?
You have lost, give up!	Você perdeu; desista!
I can call Tom if you want.	Eu posso chamar o Tom se você quiser.
What was the first book you read?	Qual foi o primeiro livro que você leu?
Tom did something he wished he hadn't.	Tom fez alguma coisa que ele desejara não ter feito.
I'm not family.	Não sou parte da família.
Buy a book and read it.	Compre um livro e leia-o.
Tom deserves another chance.	Tom merece outra chance.
There's something weird happening.	Tem alguma coisa estranha acontecendo.
Be brave.	Seja valente.
I don't find any of this interesting.	Eu não achei nada disso interessante.
I'm going to take it easy this weekend.	Vou pegar leve neste fim de semana.
Tom wasn't able to handle the problem by himself.	Tom não era capaz de lidar com o problema dele mesmo.
Tom said that's fine with him.	Tom disse que está tudo bem com ele.
Why do you ask?	Por que os senhores perguntam?
Would you mind if we talked about this later?	Você se importaria se falássemos disso depois?
I rear cattle.	Crio gado.
Spies make it their business to know things that you don't want them to know.	O trabalho dos espiões é saber coisas que você não quer que eles saibam.
We only have three hours.	Temos apenas três horas.
She has never sung a song with him.	Ela nunca cantou uma canção com ele.
You did this.	Você fez isso.
She dumped him.	Ela se livrou dele.
The dog is asleep.	O cachorro está dormindo.
I don't care what people think.	Eu não me importo com o que as pessoas pensam.
I could use something to drink.	Eu bem que aceitaria alguma coisa para beber.
Senescence is the last stage of life.	Senescência é o último estágio da vida.
Is Tom OK?	O Tom está bem?
Tommy, can you hear me?	Tommy, você consegue me ouvir?
I'm an artist.	Eu sou um artista.
Tom rarely wins.	Tom raramente vence.
Twenty-five years after Chernobyl, milk, mushrooms and berries are still contaminated in some parts of Ukraine.	Vinte e cinco anos depois de Chernobyl, leite, cogumelos e frutos ainda estão contaminados em certas partes da Ucrânia.
Aren't they adorable?	Elas não são amáveis?
She erased the video from her phone.	Ela apagou o vídeo do telemóvel.
I want to talk to you after class.	Eu quero falar com você depois da aula.
She was a tall, slender blonde.	Ela era uma loira alta e elegante.
You mean a lot to me.	Você significa muito para mim.
Let's play hopscotch.	Vamos brincar de amarelinha.
Aren't you going to vote?	Você não vai votar?
I'm sorry if I woke you up.	Desculpe se eu acordei você.
Did you ask for a discount?	Você pediu desconto?
Tom is still angry with you.	Tom ainda está bravo com você.
We studied French for three years.	Estudamos Francês durante três anos.
Look how the plane is gliding toward the field!	Olha como o avião está planando em direção ao campo de pouso!
I'm a little bit nervous.	Estou um pouco nervoso.
Are you afraid of being fired?	Está com medo de ser demitida?
Do you go out a lot?	Vocês saem muito?
I remember reading about it.	Eu me lembro de ter lido sobre isso.
It's not only Jim who is sick, but his parents as well.	Não é só o Jim que está doente, mas seus pais também.
i need buy two bolt of fabric	eu preciso comprar dois rolos de tecido
How many students in your class can swim?	Quantos alunos da sua turma podem nadar?
You were not a good student two years ago.	Você não era um bom aluno há dois anos.
No one knows me like you do.	Ninguém me conhece como você me conhece.
When I came home, my mother was standing by the door in tears.	Quando cheguei em casa, minha mãe estava parada na porta aos prantos.
I believe this man is lost.	Eu acho que esse homem está perdido.
Within the Orthodox Jewish community itself, not everybody believes an Uman pilgrimage is necessary this year.	Dentro da própria comunidade judaica ortodoxa, nem todos consideram que uma peregrinação a Uman seja necessária este ano.
I think I know what Tom is doing.	Eu acho que sei o que Tom estava fazendo.
Kate sympathized with him.	Catarina compartilhou os sentimentos dele.
What are you expecting Tom to do?	O que você espera que Tom faça?
Have you shown this to Tom already?	Você já mostrou isto ao Tom?
Who are you angry at?	Com quem você está bravo?
You should pay attention.	Você deveria prestar atenção.
What's holding Tom back?	O que está segurando o Tom?
Nobody says you can't go fishing.	Ninguém está dizendo que você não pode ir pescar.
It's very sweet.	É muito doce.
Let's go steady.	Vamos firme.
You don't have any idea what to do, do you?	Vós não tendes ideia do que fazer, não é mesmo?
I felt as happy as if I were still dreaming.	Me senti tão feliz como se ainda estivesse sonhando.
What should we do first?	O que nós deveríamos fazer primeiro?
I just needed some water.	Só precisava de um pouco de água.
Pumpkins stored away after harvest for a while become ripe and good to eat.	Abóboras armazenadas após a colheita por um tempo tornam-se maduras e boas para comer.
It's as easy as pie for him.	É muito fácil para ele.
Sometimes we need to look back to know where we are going to.	Às vezes precisamos olhar para trás para saber onde estamos indo.
It has rained for three days on end.	Está chovendo há três dias sem parar.
I think birthdays are important.	Acho que aniversários são importantes.
Let me write down the address.	Deixe-me anotar o endereço.
My stomach hurts.	Estou com dor de estômago.
Have you ever got on a boat?	Você já entrou em um barco?
Explain to me why you don't want to go anymore.	Me explique por que você não quer mais ir?
Tom isn't a third grader.	Tom não é aluno da terceira série.
Are you in love?	Você está apaixonado?
Do you know who invented the Ferris wheel?	Você sabe quem inventou a roda-gigante?
Mary poisoned herself.	Mary se envenenou.
Tom almost hurt himself trying to do that.	Tom quase se machucou tentando fazer isso.
They'll need help.	Eles vão precisar de ajuda.
Every step towards organization raises a crop of vices peculiar to itself, fresh developments of the egotism and greed and vanity of those into whose hands there falls control, fresh instances of that hostile pedantry which seems so natural to officials and managers, insurgencies and obstinacies and suspicions on the part of everyone.	Cada passo com vista à organização gera uma série de vícios específicos ao próprio passo, novos desdobramentos do egoísmo e ganância e vaidade daqueles em cujas mãos recai o controlo, novos exemplos daquele pedantismo hostil que parece tão natural aos oficiais e gestores, insurreições e obstinações e suspeitas por parte de todos.
We're not dating.	Nós não estamos namorando.
He's very young. He's much younger than Tom.	Ele é muito novo. Bem mais novo do que Tom.
Tom is making his bed.	Tom está fazendo a cama dele.
I burned the cake.	Eu queimei o bolo.
The pile of bodies under the bridge was such a macabre sight.	A pilha de cadáveres embaixo da ponte era uma visão tão macabra.
We're ready to leave.	Estamos prontos para sair.
I need that medicine.	Eu preciso daquele remédio.
The air conditioner doesn't work.	O ar-condicionado não funciona.
I want to show you what Tom gave me.	Eu quero mostrar a você o que Tom me deu.
I can't imagine doing it any other way.	Não consigo imaginar fazer de outra maneira.
She was heard to criticize the manager.	Ouviram-na criticar o gerente.
A decapitated body was on the coroner's table.	Um corpo decapitado estava na mesa do médico legista.
You're mocking me, aren't you?	Vocês estão me zoando, né?
I'm not going to talk about that today.	Não vou falar sobre isso hoje.
The day is for honest men, the night for thieves.	O dia foi feito para os homens honestos; a noite, para os ladrões.
Yes, it's true!	Sim, é verdade!
The terrain on Mars appears very hospitable.	O terreno em Marte parece muito hospitaleiro.
Cheok said different tastes are triggered by molecules that cause chemical ionization on the surface of the tongue, sending the brain electrical signals of a specific amplitude and frequency that are possible to reproduce with two electrodes.	Cheok disse que os diferentes sabores são ativados por moléculas que causam ionização química na superfície da língua, enviando ao cérebro sinais elétricos de uma amplitude e uma frequência específicas que são possíveis de reproduzir com dois elétrodos.
Tom slept a lot longer than me.	Tom dormiu muito mais tempo que eu.
He's a drug dealer.	Ele é traficante.
I couldn't prove my theory.	Eu não podia provar minha teoria.
I need a new one.	Eu preciso de um novo.
Sami took Layla's phone and car.	Sami levou o telefone e o carro de Leila.
In peace sons bury fathers, but in war fathers bury sons.	Em tempo de paz, os filhos enterram os pais, mas em tempo de guerra os pais enterram os filhos.
Let me go talk to Tom.	Deixe-me falar com o Tom.
It isn't heavy.	Não está pesada.
"What is the English for ""Saigen""?"	"Como é ""Saigen"" em inglês?"
"""What do you want?"" ""I just wanted to ask Tom something."""	"""O que você quer?"" ""Eu só queria perguntar um negócio a Tom."""
I miss college.	Sinto falta da faculdade.
I'd appreciate it if you sent me your latest catalog.	Eu ficaria grato se você me mandasse seu último catálogo.
When was this article written?	Quando este artigo foi escrito?
That was what Tom wanted to do, but he wasn't allowed to.	Era isso que Tom queria fazer, mas não tinha permissão para fazer.
I didn't know that he had actually lied to me.	Eu não sabia que ele tinha mesmo mentido para mim.
You shouldn't be doing that here.	Você não deveria estar fazendo isso aqui.
That's a proven fact.	Isso é um fato comprovado.
Do you like Joseph for a name?	Você gosta do nome Joseph?
I'm done studying.	Estou farto de estudar.
When and where did you come to know her?	Quando e onde você veio a conhecê-la?
I'm glad I learned from you.	Ainda bem que aprendi com você.
Tom doesn't want to do that now.	O Tom não quer fazer isso agora.
Tom is as hardworking as any.	O Tom trabalha duro quanto qualquer outro.
You can speak French, can't you?	Você sabe falar francês, não sabe?
I brought you rice from China.	Eu lhes trouxe arroz da China.
A strong smell of cannabis hung in the air.	Tem um cheiro forte de maconha no ar.
Trust no one.	Não confie em ninguém.
She only reads prose.	Ela lê somente prosa.
When was the last time you and Tom worked together?	Quando foi a última vez que você e Tom trabalharam juntos?
We need a break.	Nós precisamos de uma pausa.
He just glanced at me.	Ele só me viu de relance.
A racoon was stealing the fish.	Um guaxinim estava roubando os peixes.
I forgot to buy ketchup.	Eu esqueci de comprar ketchup.
You obviously don't know Tom very well.	Vocês obviamente não conhecem Tom muito bem.
Tom is good at that.	Tom é bom nisso.
Is somebody down there?	Tem alguém lá embaixo?
We all can't be blue bloods.	Nem todos podem ter sangue azul.
He shouts a lot.	Ele grita muito.
Tom said he was able to do everything he needed to do.	Tom disse que ele era capaz de fazer tudo o que precisava fazer.
Tom used to have a mustache.	Tom costumava ter bigode.
Many English words are derived from Latin.	Muitas palavras inglesas derivam-se do latim.
Have you eaten yet?	Você já comeu?
Duh.	Dã.
I almost bought one of those.	Eu quase comprei um desses.
I'll make a note of that.	Eu vou tomar nota disso.
Tom is waiting for us in his office.	Tom está esperando a gente no escritório dele.
He insured himself for a rainy day.	Ele fez seguro contra um caso de necessidade.
He slid the money into my pocket.	Ele sorrateiramente colocou o dinheiro no meu bolso.
We were all present at the meeting.	Nós estávamos todos presentes na reunião.
We love fast food.	Amamos fast food.
Fortune comes in by a merry gate.	A fortuna vem por um portão alegre.
Don't forget to talk to Tom tomorrow.	Não se esqueça de falar com Tom amanhã.
He knows he acted badly.	Ele sabe que agiu mal.
Are you fucking kidding me?	Você está me zoando?
You did that very fast, didn't you?	Você fez isso muito rápido, não foi?
Whatever may happen, I am prepared for it.	Não importa o que aconteça, estou preparado.
Tom is convinced that Mary is the one who stole his clarinet.	Tom está convencido de que Mary foi quem roubou seu clarinete.
Tom told me I'd never win again.	O Tom me disse que eu não venceria de novo.
Have you gone off your rocker?	Você ficou doido?
Tom has built three houses.	Tom construiu três casas.
Excuse me.	Desculpa!
I wanted something else.	Eu queria outra coisa.
I need a driver to take me home.	Preciso de um motorista para me levar para casa.
Never piss Fadil off.	Nunca irrite o Fadil.
Tom loves that.	Tom adora isso.
She kept me waiting for 30 minutes.	Ela me deu um chá de cadeira de meia hora.
Did you wake Tom up?	Vocês acordaram Tom?
I'm leaving you tomorrow.	Eu te deixarei amanhã.
I'll sit over there.	Eu sentarei ali.
Tom fed his horse.	Tom alimentou o cavalo dele.
It was early spring, so there weren't many customers.	Era o começo da primavera, então não havia muitos clientes.
Is that why you won't help her?	É por isso que você não vai ajudá-la?
I made brownies.	Fiz brownies.
What's Tom going to say?	O que Tom dirá?
Do you have a card?	Você tem um cartão?
Do you have any beer?	Você tem cerveja?
"""How old are you?"" ""I'm 16 years old."""	"""Quantos anos você tem?"" ""Tenho dezesseis."""
Tom might have to speak French.	Tom pode ter que falar em francês.
Tom would like to come with us.	Tom gostaria de vir conosco.
Tom still loves Mary even though she doesn't love him anymore.	Tom ainda ama Maria, embora ela não o ame mais.
I don't want a pet anymore.	Eu já não quero um animal de estimação.
I was following Tom.	Eu estava seguindo o Tom.
Children ate ice cream on hot days.	As crianças tomavam sorvete em dias quentes.
It's cold. Could you close the window?	Está frio. Você poderia fechar a janela?
Who will take care of the baby?	Quem cuidará do bebê?
Tom and Mary said that they could see ghosts.	Tom e Maria disseram que podiam ver fantasmas.
I wasn't the one who told Tom to sing.	Não fui eu quem falou para o Tom cantar.
They sound disappointed.	Eles parecem desapontados.
You've already won.	Você já ganhou.
We believe in God.	Nós cremos em Deus.
They have no children, as far as I know.	Eles não têm filhos, até onde eu sei.
We must phone for an ambulance.	Devemos chamar uma ambulância.
I play the guitar every day.	Eu toco violão todos os dias.
I need a weapon.	Preciso de uma arma.
Tom lied in bed.	O Tom deitou na cama.
I saw him last week.	Vi-o semana passada.
Who do you think can tell us the answer?	Quem você acha que pode nos dizer a resposta?
The war in Iraq happened ten years ago.	A guerra no Iraque aconteceu há dez anos.
The mall is deserted.	O shopping está deserto.
Einstein was a mathematical genius.	Einstein foi um gênio da matemática.
They're on their own.	Eles estão por conta própria.
Translation is an art, not a science.	A tradução é uma arte, não uma ciência.
Sadako smiled at them.	Sadako sorriu para elas.
What's your greatest fear?	Qual é o seu maior medo?
We spoke about an article that I had published.	Nós falamos sobre um artigo que eu tinha publicado.
I need one more.	Preciso de mais uma.
They represent not only themselves but this institution as well.	Eles não representam apenas eles mesmos, mas também essa instituição.
What I want is love.	O que eu quero é amor.
What was the cost?	Qual foi o custo?
I'd like to buy everyone a round.	Eu gostaria de comprar uma rodada para todo mundo.
Could you please turn your television down?	Vós faríeis a gentileza de diminuir o volume da televisão?
Your feet will lead you to where your heart is.	Os teus pés te levarão para onde o teu coração estiver.
Tom didn't ask for permission to leave.	Tom não pediu permissão para sair.
I am going to take out money.	Eu vou tirar dinheiro.
My car stalled in the tunnel.	Meu carro enguiçou no túnel.
I cannot stand you anymore.	Não posso mais te suportar.
Tom has a dog, too.	Tom também tem um cachorro.
Tom is talking to someone in French.	Tom está conversando com alguém em francês.
Tom said that I should win.	Tom disse que eu deveria vencer.
The potatoes stayed hot.	As batatas permaneceram quentes.
This building is new.	Este prédio é novo.
My older brother is an authority on philosophy.	Meu irmão mais velho é uma autoridade quando o assunto é filosofia.
What do you mean you don't know?!	O que você quer dizer com você não sabe?
Have you taken the test?	Você fez o teste?
Tom didn't want an expensive camera.	O Tom não queria uma câmera custosa.
Tom is a good sort.	Tom é uma boa pessoa.
Tom was waiting over there for you, but I don't see him now.	Tom estava esperando pelo senhor ali, mas agora eu não o vejo.
I think the job is done.	Eu acho que o trabalho está feito.
I've changed clothes.	Troquei de roupa.
He has been living in Ankara since 2006.	Ele vive em Ancara desde 2006.
I'll take care of it immediately.	Eu cuidarei disso imediatamente.
Concentrate on the mission!	Concentre-se na missão!
That's confusing.	É confuso.
I just try not to think about it.	Eu só tento não pensar sobre isso.
Gloria hasn't lived in Rio for many years.	Há muitos anos que Glória não mora no Rio.
Everybody in the room was snoring.	Todo mundo na sala estava roncando.
You'll have to come with me.	Você terá de vir comigo.
I need to buy some rat poison.	Preciso comprar algum raticida.
Paul Levinson said that any attempts to abridge that right — either by governments or through commercial pressure from web providers — will ultimately fail.	Paul Levinson disse que quaisquer tentativas de restringir esse direito — quer pelos governos, quer através da pressão comercial dos fornecedores de internet — acabarão por fracassar.
Tom never seemed to be interested in learning French.	Tom nunca parecia estar interessado em aprender Francês.
I have to get him out of here.	Tenho de tirá-lo daqui.
Cats don't have owners, they have staff.	Os gatos não têm donos, eles têm funcionários.
Tom made Mary angry.	Tom deixou Mary brava.
I wanted to buy a dog.	Eu queria comprar um cachorro.
Say what you want.	Digam o que vocês quiserem.
Where would you rather go?	Aonde você prefere ir?
Do you find it funny that I feel this way?	Você acha engraçado eu me sentir assim?
I wish I had got married to her.	Queria ter me casado com ela.
I drink water when I'm thirsty.	Eu bebo água quando estou com sede.
There's a water shortage in this area.	Há escassez de água nesta área.
The phone needs to be charged.	O telefone precisa ser carregado.
I need you to stay here.	Preciso que você fique aqui.
Nobody believed Tom.	Ninguém acreditou em Tom.
I can't speak French.	Não falo francês.
Please come to see me tomorrow.	Venha me ver amanhã, por favor.
It's good you don't have to study so hard.	É bom que você não precise estudar tanto.
Wait for me by the car!	Espere por mim ao lado do carro!
Then she said a prayer that was an oblique attack on the Obama administration's policies.	Depois ela proferiu uma oração que era um ataque indireto às políticas da administração Obama.
There, something completely different.	Eis algo completamente diferente.
We left together.	Partimos juntos.
Will it rain?	Será que chove?
Shouting isn't singing.	Gritar não é cantar.
Are you hungry?	Estás com fome?
We often eat together.	Nós geralmente comemos juntos.
The car is black.	O carro é preto.
I have no idea who that man was.	Não faço ideia de quem era aquele homem.
I didn't know you were down there.	Eu não sabia que você estava aí embaixo.
Mennad was on a double-divided highway.	Mennad estava em uma via expressa.
Come and I'll show you what I do to frogs like you.	Venha e te mostrarei o que faço com rãs como você.
Why would Tom want me to help him?	Por que o Tom iria querer que eu o ajudasse?
She moved my clothes.	Ela mexeu em minhas roupas.
So, what do you find so interesting about dinosaurs?	Então, o que você acha tão interessante em dinossauros?
I'm fine, thanks!	Estou bem, obrigado!
Will you wait for me?	Você vai esperar por mim?
Tom doesn't like apples, does he?	Tom não gosta de maçãs, não é?
Should we be worried?	Nós deveríamos estar preocupados?
They didn't believe me.	Eles não acreditaram em mim.
This is standard procedure.	Isto é procedimento padrão.
What parts of the city have to be visited?	Que partes da cidade se devem visitar?
I'm glad she didn't come.	Ainda bem que ela não veio.
Mary was impressed with what she saw.	A Mary estava impressionada com o que ela viu.
Don't open your mouth, and your physiognomy demonstrates a preoccupation.	Você não abre a boca, e sua fisionomia aparenta preocupação.
I don't often eat out.	Eu não costumo comer fora.
The room was jam-packed with reporters waiting for the press conference to begin.	A sala estava repleta de repórteres esperando a coletiva de imprensa começar.
She was laughed at.	Riram dela.
It'll take hours.	Vai levar horas.
Tom asked Mary to look after the children.	Tom pediu para Mary tomar conta das crianças.
I had to wait so long that I fell asleep in the chair.	Eu tive de esperar tanto que adormeci na cadeira.
I know Tom isn't as patient as I am.	Eu sei que o Tom não é tão paciente quanto eu.
