Did Tom know Mary?	O Tom conhecia a Mary?
In addition to her endeavors on the track, the American high jumper is studying toward a degree in medicine and does some modeling on the side.	Para além das suas conquistas na pista, a atleta americana do salto em altura está a estudar Medicina e faz ocasionalmente trabalhos de modelo.
We've got to warn Tom about that.	Temos de avisar o Tom disso.
My sister washes her shoes every Sunday.	A minha irmã lava os sapatos todos os domingos.
I wish you would reconsider.	Gostava que reconsiderasses.
He started crying right after hearing the news.	Ele começou a chorar logo depois de ouvir a notícia.
Tom never listens to anyone.	O Tom nunca ouve ninguém.
Don't forget to answer his letter.	Não te esqueças de responder à carta dele.
I used to smoke.	Eu fumava.
How far is the next farm?	A que distância fica a próxima quinta?
I have a bad pain here.	Estou com uma dor forte aqui.
That's the stupidest thing I've ever said.	Esta foi a coisa mais estúpida que eu já disse.
Tom was in his top form.	O Tom estava na melhor forma.
This is the best restaurant that I know.	Este é o melhor restaurante que conheço.
He knows everything.	Ele sabe tudo.
Australia is on my list of countries that I'd like to visit.	A Austrália está na minha lista de países que gostaria de visitar.
Tom may come here.	O Tom pode vir cá.
We've arrived pretty quickly, haven't we?	Chegámos bem depressa, não foi?
Carlos Queiroz was fired by the Portuguese Football Federation.	Carlos Queiroz foi demitido pela Federação Portuguesa de Futebol.
What do you want to do after lunch?	O que é que queres fazer depois do almoço?
We'll rebuild.	Reconstruiremos.
The last thing I want to do is waste time.	A última coisa que quero fazer é perder tempo.
Fadil became the fifth man to divorce Layla.	O Fadil tornou-se o quinto homem a divorciar-se da Layla.
With fears of the coronavirus pandemic sweeping the U.S., Democratic presidential candidates Joe Biden and Bernie Sanders are staging virtual rallies Monday, a day ahead of presidential nominating primary elections in four states that Biden is expected to win handily.	Com o receio da pandemia de coronavírus a alastrar pelos EUA, os candidatos democratas à presidência, Joe Biden e Bernie Sanders, realizam comícios virtuais na segunda-feira, um dia antes das primárias em quatro estados onde se prevê que Biden vença confortavelmente.
I'd like to earn more money.	Gostaria de ganhar mais dinheiro.
It probably would be cheaper somewhere else.	Provavelmente seria mais barato noutro sítio.
Jack doesn't have enough money to buy himself a new bicycle.	O Jack não tem dinheiro suficiente para comprar uma bicicleta nova.
Tom couldn't decide where to plant the tree.	O Tom não conseguiu decidir onde plantar a árvore.
I have great friends.	Tenho grandes amigos.
I could never do that.	Nunca poderia fazer isso.
Welcome to Boston, Tom.	Bem-vindo a Boston, Tom.
This is not the time or the place.	Não é a hora nem o lugar.
Tom played the violin.	O Tom tocava violino.
Is this your interesting book?	Este é teu livro interessante?
What do you think I've been doing?	O que é que achas que eu tenho estado a fazer?
Tom never was very interested.	O Tom nunca se interessou muito.
Doing that won't accomplish anything.	Fazer isso não servirá de nada.
Great Britain has two military bases in Cyprus.	A Grã-Bretanha tem duas bases militares em Chipre.
Tom is sitting by the window.	O Tom está sentado à janela.
I will try to be on time.	Vou tentar ser pontual.
Who turned off the light?	Quem apagou a luz?
Do not throw or drop the console or accessories, or expose them to strong physical shock.	Não atires nem deixes cair a consola ou os acessórios, nem os submetas a fortes impactos.
After the rain, the sun emerged from the clouds.	Depois da chuva, o sol emergiu das nuvens.
Smiling makes me happy.	Sorrir deixa-me feliz.
Tom stopped using Facebook.	O Tom deixou de usar o Facebook.
Loving to work is the key to happiness.	Amar o trabalho é a chave da felicidade.
I know everything.	Eu sei tudo.
You don't have to hide anything from me.	Não tens de esconder nada de mim.
You've been keeping something from me.	O senhor tem-andado a ocultar-me qualquer coisa.
Fadil's plan was his downfall.	O plano do Fadil foi a sua ruína.
I should've eaten more.	Devia ter comido mais.
Please do your best.	Faz o teu melhor, por favor.
I would be willing to help you.	Eu estaria disposto a ajudar-te.
They asked Tom to do a job, but he played the fool and pretended he didn't hear it.	Pediram ao Tom para fazer um trabalho, mas ele fez-se de desentendido.
Tom already went home, but Mary is still here.	O Tom já foi para casa, mas a Mary ainda está aqui.
I can't tell you why Tom is late.	Não te posso dizer porque é que o Tom está atrasado.
Dan's message was insulting.	A mensagem do Dan era ofensiva.
I'll be with Tom all morning.	Estarei com o Tom a manhã toda.
What time will Tom arrive in Boston?	A que horas chegará o Tom a Boston?
How long is this visa good for?	Durante quanto tempo é válido este visto?
The boy who lives next door helped me paint the fence.	O rapaz que mora na casa ao lado ajudou-me a pintar a vedação.
If X means Y, what does Z mean?	Se X significa Y, o que Z significa?
Tom needs to find Mary.	O Tom tem de encontrar a Mary.
Judo is not only good for young people's health but also very useful in forming their personalities.	O judo não é apenas bom para a saúde dos jovens; é também muito útil na formação da sua personalidade.
Tom has Monday off.	O Tom tem a segunda-feira livre.
The clouds are gray.	As nuvens estão cinzentas.
You are not to blame for anything.	Não tens culpa de nada.
I decided. I'm going to ask him out tonight.	Já decidi. Vou convidá-lo para sair esta noite.
I abhor violence.	Abomino a violência.
There are many things that time does not heal.	Há muitas coisas que o tempo não cura.
Tom called my name.	O Tom chamou o meu nome.
Tom is a great guitarist.	O Tom é um ótimo guitarrista.
Nobody likes to work with Tom.	Ninguém gosta de trabalhar com o Tom.
How amazing!	Que incrível!
Tom hasn't been seen since October.	O Tom não foi visto desde outubro.
The revolution is over.	A revolução acabou.
Hundreds of people were waiting outside the ticket office.	Centenas de pessoas estavam à espera do lado de fora da bilheteria.
I can't afford to buy such an expensive car.	Não tenho condições para comprar um carro tão caro.
Tom got back to Boston yesterday evening.	O Tom regressou a Boston ontem à noite.
That man is dead.	Aquele homem está morto.
There are things known and there are things unknown, and in between are the doors of perception.	Existem coisas conhecidas e coisas desconhecidas, e entre ambas estão as portas da perceção.
We're looking to you for help.	Contamos contigo para obter ajuda.
Tom contributed a lot of money to charity.	O Tom contribuiu com muito dinheiro para a caridade.
This drawing dates back to the fifteenth century.	Este desenho remonta ao século XV.
Tom tried really hard to win.	O Tom esforçou-se muito para ganhar.
This is my favorite color.	Esta é a minha cor favorita.
Is it the best thing they did?	Foi a melhor coisa que elas fizeram?
I often chew some mentholated gum after a meal.	Costumo mascar pastilhas de mentol depois das refeições.
I wish I were thinner.	Queria ser mais magra.
The ABC company is in the red again.	A empresa ABC está novamente em prejuízo.
Tom will apologize.	O Tom pedirá desculpa.
Yesterday I had the pleasure of accompanying a foreign friend all across Paris.	Ontem tive o prazer de acompanhar uma amiga estrangeira por toda Paris.
Equestrian is the only mixed-gender Olympic event.	A equitação é a única modalidade olímpica mista.
The road was crowded with various vehicles.	A estrada estava cheia de diversos veículos.
Tom has a fast 56k modem.	O Tom tem um modem rápido de 56k.
We'll try one more time.	Vamos tentar mais uma vez.
Tom helped Mary escape from jail.	O Tom ajudou a Mary a fugir da prisão.
Tom is better than us.	O Tom é melhor do que nós.
My wife was mad.	A minha mulher era louca.
He had been embarrassed.	Ele tinha ficado envergonhado.
How do you know that?	Como é que sabes isso?
I'm not a wizard, but I know what everybody says about me.	Não sou bruxo, mas sei o que toda a gente diz de mim.
I wish you a good trip!	Desejo-te boa viagem!
The house fell down a week later.	A casa caiu uma semana depois.
I have been told that I am pragmatic, and I am.	Dizem-me que sou pragmático, e sou.
You're in better shape than I am.	Estás em melhor forma que eu.
Nobody will find that treasure.	Ninguém vai encontrar esse tesouro.
The castle has been restored and is open to the public.	O castelo foi restaurado e está aberto ao público.
She didn't give me my money back.	Ela não me devolveu o dinheiro.
This could become quite interesting.	Isto pode tornar-se bastante interessante.
I'm hoping to go to Boston next month.	Espero ir a Boston no próximo mês.
That's how we first met.	Foi assim que nos conhecemos.
Tesla's life's full of mystery.	A vida de Tesla está cheia de mistério.
Children should always mix their wine, with at least two-thirds water.	As crianças devem sempre misturar o vinho com pelo menos dois terços de água.
Tom and Mary's doctor advised them to get more exercise.	O médico do Tom e da Mary aconselhou-os a praticar mais exercício.
They are going to emigrate to America.	Eles vão emigrar para a América.
Jazz is not my speciality.	O jazz não é minha especialidade.
"Today's topic is the problem of Japanese people abducted by North Korea."	O tema de hoje é «o problema dos japoneses raptados pela Coreia do Norte».
He started to sing.	Ele começou a cantar.
Another day passed.	E assim se passou mais um dia.
The baby was quiet all night.	O bebé esteve sossegado toda a noite.
Fish is normally accompanied by white wine.	O peixe costuma ser acompanhado de vinho branco.
We have elected him chairman of the meeting.	Elegemo-lo presidente da reunião.
I knew I had to do my homework myself.	Eu sabia que tinha de fazer o meu trabalho de casa eu mesmo.
It was a huge win for us.	Foi uma grande vitória para a gente.
Tom is disgusted.	O Tom está enojado.
Keep away from me, devil!	Afasta-te de mim, diabo!
I'm taking tomorrow afternoon off.	Amanhã à tarde vou tirar folga.
We'll help you.	Ajudar-te-emos.
I want to eat some cake first.	Quero comer um bocadi de bolo primeiro.
I gave Tom all my money.	Dei ao Tom todo o meu dinheiro.
My dad will kill me.	O meu pai vai matar-me.
I tried to avoid looking at her eyes.	Procurei não olhar diretamente para os olhos dela.
Tom is a comedian.	O Tom é humorista.
Can we hit the road?	Podemos pôr-nos a caminho?
Researchers at the University of Maryland say a fiery phenomenon called blue whirl could someday help clean up oil spills on water.	Investigadores da Universidade de Maryland afirmam que um fenómeno flamejante, o “redemoinho azul”, poderá um dia ajudar a limpar derrames de petróleo sobre a água.
We all have missed you.	Todos nós sentimos a tua falta.
I'm so glad that Tom is gone.	Estou tão contente por o Tom se ter ido.
I didn't sleep so much.	Não dormi assim tanto.
Tom thinks that his life is boring.	O Tom acha que a sua vida é aborrecida.
By the time you realize I'm gone, I'll be miles away. Don't try to find me.	Quando te aperceberes de que fui embora, estarei a quilómetros. Não tentes procurar-me.
Tom wasn't taken hostage.	O Tom não foi feito refém.
I had an egg sandwich for lunch.	Almocei uma sandes de ovo.
We shouldn't resort to violence.	Não devíamos recorrer à violência.
Do you know what time the shop is closed?	Sabes a que horas a loja fecha?
A white dove is on the roof.	Há uma pomba branca no telhado.
Sami understands Layla's concerns.	O Sami compreende as preocupações da Layla.
She made me a star.	Ela fez de mim uma estrela.
I've never known anyone as hypocritical as you.	Nunca conheci ninguém tão hipócrita como tu.
It's dead in here.	Não há ninguém aqui.
I have a sensitive skin.	Tenho a pele sensível.
This is a hospital.	Estamos num hospital.
Its origin is unknown.	A sua origem é desconhecida.
The lychee harvest is in full swing in Vietnam's northern Hai Duong province, but local officials say fewer Chinese traders have come to buy the sweet and juicy fruit this summer due to concerns about anti-China sentiment.	A colheita da lichia está em pleno curso na província de Hai Duong, no norte do Vietname, mas as autoridades locais dizem que menos comerciantes chineses vieram comprar o fruto doce e suculento este Verão, devido a preocupações com o sentimento anti-China.
Thanks for coming so quickly.	Obrigado por teres vindo tão depressa.
If I had wanted your opinion, I would have asked for it.	Se quisesse a tua opinião, tinha pedido.
This is the first time I've ever wiped all the tables.	É a primeira vez que limpo todas as mesas.
What did Ferdinand Magellan do?	O que fez Fernão de Magalhães?
Is the baby able to walk?	O bebé sabe andar?
Glad you found this lesson useful.	Fico contente que tenhas achado esta lição útil.
I've been in New York once.	Estive em Nova Iorque uma vez.
Mr Kennedy pointed out our mistakes.	O Sr. Kennedy mostrou-nos os nossos erros.
Tom and Mary live on a farm and have 16 children.	O Tom e a Mary vivem numa quinta e têm 16 filhos.
It's still frozen.	Ainda está congelado.
Tom went diving with sharks.	O Tom foi mergulhar com tubarões.
Whatever doesn't kill us only makes us stronger.	O que não nos mata torna-nos mais fortes.
I am an omnivore.	Sou omnívoro.
The message has been encoded.	A mensagem foi codificada.
I don't know what's real.	Não sei o que é real.
My finger turned brown after I dipped it in a slightly concentrated solution of potassium permanganate.	O meu dedo ficou castanho depois de o mergulhar numa solução ligeiramente concentrada de permanganato de potássio.
It's very cold in my house.	Está muito frio na minha casa.
The salmonella bacteria are directly associated with the turtles.	A bactéria salmonela está diretamente associada às tartarugas.
Don't throw away your money.	Não desperdices o teu dinheiro.
While COVID-19 spares few nations, Malaysia faces a combination of issues in particular.	Embora poucas nações escapem à COVID-19, a Malásia enfrenta uma combinação particular de problemas.
Tom is early again.	O Tom chegou cedo de novo.
At midnight everybody entered.	À meia-noite toda a gente entrou.
I hope that you follow my advice.	Espero que sigas o meu conselho.
Please don't let go of my hand.	Por favor, não largues a minha mão.
We can deal with this.	Podemos lidar com isto.
I will give you a recipe.	Vou dar-te uma receita.
We have a long walk ahead of us.	Temos uma longa caminhada pela frente.
I was for some time apprehensive that it would be necessary, on account of the contagious sickness which afflicted the city of Philadelphia, to convene the National Legislature at some other place.	Fiquei durante algum tempo apreensivo de que, devido à doença contagiosa que assolava a cidade da Filadélfia, fosse necessário reunir a Legislatura Nacional noutro local.
Can I go swimming?	Posso ir nadar?
A large fire broke out Saturday at Lhasa's Jokhang monastery, one of the most sacred sites for Tibetan Buddhism.	No sábado deflagrou um grande incêndio no mosteiro Jokhang, em Lhasa, um dos locais mais sagrados do budismo tibetano.
Would you wait here for a minute?	O senhor pode esperar aqui um minuto?
What will dessert be?	Qual será a sobremesa?
Tom wants to surprise Mary.	O Tom quer surpreender a Mary.
My room has only one window.	O meu quarto tem apenas uma janela.
My birthday party is tomorrow.	A minha festa de anos é amanhã.
Tom didn't know that Mary had just gotten married.	O Tom não sabia que a Mary se tinha acabado de casar.
Tom seems happy again.	O Tom parece feliz outra vez.
I suspect Tom shouldn't be here.	Suspeito que o Tom não deva estar aqui.
The children want to play outside.	As crianças querem brincar lá fora.
I finally stopped trying to persuade Tom to clean his room.	Acabei por deixar de tentar convencer o Tom a arrumar o quarto.
The sculptures are of great value.	As esculturas são de grande valor.
Tom won't hear you.	O Tom não te vai ouvir.
It's not worth it anymore.	Já não vale a pena.
I was angry that I had been fooled.	Fiquei zangado por ter sido enganado.
Tom drew his gun and fired.	O Tom sacou da arma e disparou.
Thank you for decorating my house.	Obrigado por decorares a minha casa.
Fadil left without a word to anyone.	O Fadil saiu sem dizer uma palavra a ninguém.
We saw each other on the street.	Vimo-nos na rua.
We're going to the store together.	Vamos juntos à loja.
Check, please.	A conta, por favor.
The moonlight is dim.	A luz da lua está fraca.
The twentieth most frequent letter in Esperanto is 'c'.	A vigésima letra mais frequente em esperanto é o 'c'.
Exercise caution in your business affairs; for the world is full of trickery. But let this not blind you to what virtue there is; many persons strive for high ideals; and everywhere life is full of heroism.	Age com cautela nos teus negócios, pois o mundo está cheio de enganos. Mas isso não te deve cegar para a virtude que existe; muitas pessoas lutam por altos ideais; e a vida está cheia de heroísmo.
Technology has improved since then.	A tecnologia melhorou desde então.
Will Tom eat with us?	O Tom vai comer connosco?
I think that it'll be OK.	Acho que ficará tudo bem.
Despite being ranked a not-so-lofty 116 in the FIFA World Ranking Table, Vietnamese fans at any big soccer match can attest to high enthusiasm when it comes to supporting their country in international events.	Apesar de estar colocado num nada elevado 116.º lugar no ranking mundial da FIFA, os adeptos vietnamitas em qualquer grande jogo de futebol provam o enorme entusiasmo com que apoiam o seu país em competições internacionais.
Fadil did one of the autopsies.	O Fadil fez uma das autópsias.
Grant attacked Vicksburg several times.	Grant atacou Vicksburg várias vezes.
Why do you want to buy this book?	Porque é que queres comprar este livro?
Health is the most precious thing.	A saúde é o bem mais precioso.
I'm allergic to antibiotics.	Sou alérgico a antibióticos.
Tom didn't want to tell Mary the sad news.	O Tom não quis dar a má notícia à Mary.
Were you in Rita's house?	Já estavas na casa da Rita?
Women have beauty, but do books not also have beauty?	As mulheres têm beleza, mas os livros não terão também beleza?
The world is not enough.	O mundo não basta.
The elephant is grey.	O elefante é cinzento.
This mango is sweet.	Esta manga está doce.
My favorite tree is the weeping willow.	A minha árvore favorita é o chorão.
Come and look for yourself.	Vem e vê tu mesmo.
This novel describes the life of the Japanese as it was a hundred years ago.	Este romance descreve a vida do japonês tal como era há cem anos.
Heeled shoes may have been invented by ancient horsemen in the Near East, says Elizabeth Semmelhack, curator at the Bata Shoe Museum in Toronto, Canada.	Os sapatos de salto podem ter sido inventados por cavaleiros antigos do Próximo Oriente, diz Elizabeth Semmelhack, curadora do Bata Shoe Museum em Toronto, Canadá.
Persian Gulf is an element of historical identity of Iranian People.	O Golfo Pérsico é um elemento da identidade histórica do povo iraniano.
I'm sorry. I didn't mean to scare you.	Desculpem, não quis assustar-vos.
What caused this crash?	O que provocou este acidente?
I own a yacht.	Tenho um iate.
We can't find Tom.	Não conseguimos encontrar o Tom.
I got everything that I asked for.	Tenho tudo o que pedi.
I asked Tom to stay.	Pedi ao Tom que ficasse.
Osgood filled Cleveholm with trophy animal heads, Tiffany lamps, ruby velvet drapes, and imported leather wall coverings.	Osgood decorou Cleveholm com cabeças de animais de troféu, candeeiros Tiffany, cortinados de veludo rubi e revestimentos de parede em couro importado.
The birthday of this American singer is September 11.	O aniversário desta cantora americana é a 11 de setembro.
Where will you spend your next vacation?	Onde é que vocês passarão as próximas férias?
Who gave him so much money?	Quem lhe deu tanto dinheiro?
He cancelled the meeting at the last minute.	Ele cancelou a reunião no último minuto.
The pink flamingo — a symbol of American leisure beloved by some but reviled by others as the epitome of bad taste — is in trouble.	O flamingo cor-de-rosa — símbolo do lazer americano amado por alguns e odiado por outros como epítome de mau gosto — está em perigo.
Bargaining is normal in this country.	A pechincha é normal neste país.
It's easy to see the area's majestic topography from the cockpit of a helicopter.	É fácil ver a topografia majestosa da zona a partir da cabine de um helicóptero.
Tom wants to see a doctor as soon as possible.	O Tom quer consultar um médico quanto antes.
All we've got is each other.	Só nos temos um ao outro.
Why do you want us to have it?	Porque é que queres que o tenhamos?
Come and visit me when you are feeling better.	Vem visitar-me quando estiveres melhor.
It was hot last night.	Ontem à noite estava calor.
All students of English should have a good English-English dictionary at hand.	Todos os estudantes de inglês devem ter à mão um bom dicionário Inglês-Inglês.
Does Tom like working here?	O Tom gosta de trabalhar aqui?
Tom promised he'd do that before he went home.	O Tom prometeu que faria isso antes de ir para casa.
Fadil tried to murder his father-in-law.	O Fadil tentou matar o sogro.
The pirates sailed the seven seas.	Os piratas navegavam pelos sete mares.
I'll be leaving for Australia next week.	Parto para a Austrália na semana que vem.
My sister often cries.	A minha irmã chora frequentemente.
Maybe she can tell you more.	Talvez ela te possa dizer mais.
We'll continue this discussion later.	Nós vamos continuar esta discussão mais tarde.
Let's try it again.	Vamos tentar outra vez.
Ellie loves that poet. She knows many of his poems by heart.	A Ellie ama aquele poeta. Ela sabe muitos dos seus poemas de cor.
Now is the time.	Agora é o momento.
I'm going to order another beer.	Vou pedir mais uma cerveja.
It'll probably take you about three hours to do that.	Vais provavelmente demorar cerca de três horas a fazer isso.
Greece has a great history.	A Grécia tem uma grande história.
I had to go back.	Tive de voltar.
He wouldn't give you anything.	Ele não te daria nada.
It is very far as far as I know.	Até onde sei, fica muito longe.
The company produces soy sauce and other food products.	A empresa produz molho de soja e outros produtos alimentares.
Does anybody have a can opener?	Alguém tem um abre-latas?
The many birds that choose Bolinas as their winter home would have a feast if these butterflies were edible, but Monarchs are protected by an acrid secretion which is distasteful to birds, and enjoy a long life on this account, living not only all winter, but long enough to taste the sweetness of the spring wildflowers.	As muitas aves que escolhem Bolinas como refúgio de inverno teriam um banquete se estas borboletas fossem comestíveis, mas as monarcas estão protegidas por uma secreção acre, desagradável para as aves, e, por isso, desfrutam de uma vida longa, sobrevivendo não só durante todo o inverno mas também tempo suficiente para provar a doçura das flores silvestres da primavera.
Tom wanted Mary to talk to John.	O Tom queria que a Mary falasse com o John.
Tom thinks Mary is cute.	O Tom acha a Mary querida.
A group of gangsters stole the money.	Um grupo de bandidos roubou o dinheiro.
Tom told Mary that he was going to kill himself, but he didn't have the courage to do it.	O Tom disse à Mary que se ia suicidar, mas não teve coragem.
Don't forget to close the door.	Não te esqueças de fechar a porta.
Failing to plan is planning to fail.	Falhar ao planear é planear falhar.
We have lots of important things to do.	Temos muitas coisas importantes para fazer.
Mary leaned on Tom's arm.	A Mary apoiou-se no braço do Tom.
I knew that I had to buy something.	Sabia que tinha de comprar alguma coisa.
There's nothing worse than a long-distance relationship.	Não há nada pior do que uma relação à distância.
The pretty girl in the bikini was an eye-opener on the beach.	A bela jovem de biquíni na praia chamava a atenção.
Tom was the first person to arrive.	O Tom foi a primeira pessoa a chegar.
Getting nowhere.	Não estou a chegar a lugar nenhum.
I haven't been home since last Monday.	Não estou em casa desde segunda-feira passada.
There are a lot of stars which are larger than our sun.	Há muitas estrelas maiores que o nosso Sol.
Tom will graduate in October.	O Tom vai licenciar-se em outubro.
I'll give you what help I can.	Darei-te a ajuda que puder.
I'm not good at pretending.	Não sou bom a fingir.
I don't have anything to say to you.	Não tenho nada para te dizer.
Every time he goes out, he drops in at the bookstore.	Sempre que ele sai, passa pela livraria.
I bought this for my mother.	Comprei isto para a minha mãe.
She was the first one to notice him.	Ela foi a primeira a notá-lo.
Don't tell anyone our plan.	Não contes o nosso plano a ninguém.
We'll meet on Monday.	Encontrar-nos-emos na segunda-feira.
I'll call first.	Primeiro telefono.
Tom refused to worry about the future.	O Tom recusou-se a preocupar-se com o futuro.
Tom visits Mary every time he goes to Boston.	O Tom visita a Mary sempre que vai a Boston.
Tom paid the fare.	O Tom pagou a tarifa.
This cold weather gives me goosebumps.	Este frio põe-me arrepiado.
Tom's mother was a wise woman.	A mãe do Tom era uma mulher sábia.
We won, thanks to you.	Vencemos, graças a ti.
Tom stayed in the hotel.	O Tom ficou no hotel.
We have to find somewhere safe to wait.	Temos de encontrar um lugar seguro onde esperar.
