Let's split the bill.	Vamos dividir a conta.
I'm starting to get used to living here.	Estou a começar a habituar-me a viver aqui.
Faith is taking the first step, even when you don't see the whole staircase.	A fé é dar o primeiro passo, mesmo sem ver a escada inteira.
That's how we do things.	É assim que fazemos as coisas.
There are many things we do not know, but we think we know everything.	Há muitas coisas que não sabemos, mas pensamos que sabemos tudo.
I think I'm going to be here on Monday.	Acho que vou estar aqui na segunda-feira.
The torture had dramatic consequences on his personality.	A tortura teve consequências dramáticas na sua personalidade.
Tom never told me.	O Tom nunca me disse.
Be quiet, or the baby will wake up.	Está calado, senão o bebé acorda.
It is difficult for me to play the piano.	É-me difícil tocar piano.
We can't complain.	Não nos podemos queixar.
I'll give you a good example.	Darei um bom exemplo.
Paleontologist Torrey Nyborg is helping with the digitization process by going through drawers filled with fossil crabs and making sure they are identified properly before the specimens are entered into a database at the National History Museum of Los Angeles County.	O paleontólogo Torrey Nyborg ajuda no processo de digitalização, revendo gavetas repletas de caranguejos fósseis e certificando-se de que estão corretamente identificados antes de serem inseridos na base de dados do Museu de História Natural do Condado de Los Angeles.
That's not the worst-case scenario.	Esse não é o pior cenário.
He peels his apple.	Ele descasca a maçã.
You got a girlfriend? Since when?	Tens namorada? Desde quando?
Mary showed her stamp collection to Tom.	A Mary mostrou a sua coleção de selos ao Tom.
He is called Jeff by everyone.	Toda a gente lhe chama Jeff.
But if a woman is partial to a man, and does not endeavour to conceal it, he must find it out.	Mas se uma mulher sente preferência por um homem e não tenta ocultá-lo, cabe-lhe a ele aperceber-se disso.
Just as I was about to go out, it started raining.	Mesmo quando eu ia sair, começou a chover.
I'm sorry to trouble you, but could you tell me the way to the station?	Desculpe incomodá-la, mas a senhora pode indicar-me o caminho para a estação?
Pull into shape after washing.	Remodela a forma após a lavagem.
Ginger — whether it's fresh, powdered or pickled — adds zest to all sorts of dishes.	O gengibre — seja fresco, em pó ou em conserva — acrescenta sabor a todo o tipo de pratos.
Tom can help you find what you're looking for.	O Tom pode ajudar-te a encontrar o que procuras.
They were told to stay on the ship.	Disseram-lhes para ficarem no navio.
This hotel has accommodations for 1000 guests.	Este hotel tem acomodações para 1000 hóspedes.
Welcome home, Tom.	Bem-vindo a casa, Tom.
Today I went to the dentist's.	Hoje fui ao dentista.
Tom will work for us.	O Tom vai trabalhar para nós.
They succeeded in catching the tiger alive.	Conseguiram capturar o tigre vivo.
I love a challenge.	Adoro um desafio.
Can you wake me up at seven?	Podes acordar-me às sete?
Stay here.	Fiquem aqui.
I can only tell you what I know.	Só lhe posso dizer o que sei.
Tom will never stop loving Mary.	O Tom nunca deixará de amar a Mary.
It could be anyone.	Podia ser qualquer um.
Let's eat here.	Vamos comer aqui.
Tom says he'll never go again.	O Tom diz que nunca mais irá.
That woman goes to church every evening.	Aquela mulher vai à igreja todas as noites.
Do something useful.	Faz algo útil.
Tom likes to do things like that.	O Tom gosta de fazer coisas desse género.
The team had a great performance.	A equipa teve um desempenho excelente.
What about his girlfriend?	E a namorada dele?
I'm glad everything is fine.	Ainda bem que está tudo bem.
Tom found the letter that Mary had hidden.	O Tom encontrou a carta que a Mary tinha escondido.
Are you still here?	Ainda estás aqui?
Why would Tom lie about his age?	Porque é que o Tom havia de mentir sobre a idade?
She's not my friend.	Ela não é minha amiga.
Is there anything on the floor?	Há alguma coisa no chão?
Keep your eye on Tom.	Fica de olho no Tom.
I went to the beach.	Fui à praia.
What do you want to watch?	O que querem ver?
If anyone calls for me, tell them I'm not here.	Se alguém perguntar por mim, diz que não estou.
I'm hoping Tom can do that for me.	Espero que o Tom consiga fazer isso por mim.
I have several pairs of shoes.	Tenho vários pares de sapatos.
Tom made the right decision.	O Tom tomou a decisão certa.
Get a ticket for me.	Arranja-me um bilhete.
I want to buy some shoes.	Quero comprar uns sapatos.
I think it's reasonable.	Acho razoável.
Why don't you join in the conversation?	Porque não te juntas à conversa?
Tom knew Mary didn't want to do that, but he wanted her to do it anyway.	O Tom sabia que a Mary não queria fazer aquilo, mas queria que ela o fizesse na mesma.
The nurse can tell you how to do it.	A enfermeira pode explicar-te como fazer.
We get along pretty well with one another.	Damos-nos muito bem.
Her anxiety was apparent to everyone.	A ansiedade dela era evidente para todos.
"Researchers in AI, artificial intelligence, must take care to encourage friendly AI, not unfriendly AI."	"Os investigadores em IA (inteligência artificial) devem apoiar uma IA 'amigável', não uma IA 'hostil'."
I've been in the hospital once.	Já estive no hospital uma vez.
I don't have to study tonight. I think I'll watch television for a while.	Não tenho que estudar hoje à noite. Acho que vou ver televisão um bocado.
Can you wait here, please?	Podes esperar aqui, por favor?
There doesn't seem to be anyone home.	Parece não estar ninguém em casa.
I think you shouldn't be doing that.	Acho que não devias estar a fazer isso.
I've never seen one.	Nunca vi nenhum.
I've locked the door.	Fechei a porta à chave.
Mary asked Tom to help decorate her Christmas tree.	A Mary pediu ao Tom para a ajudar a decorar a sua árvore de Natal.
Tom promised he wouldn't tell anybody.	O Tom prometeu que não contaria a ninguém.
Didn't you use to have a car?	Não costumavas ter um carro?
I'm bad at sports.	Sou fraco nos desportos.
When are you going on holiday this year?	Quando vais de férias este ano?
Portuguese, Spanish, French and Italian are Romance languages.	O português, o espanhol, o francês e o italiano são línguas românicas.
Why are you drinking coffee at midnight?	Porque é que estás a beber café à meia-noite?
We aren't married.	Não estamos casados.
I think the rumor is true.	Acho que o rumor é verdadeiro.
Keep hold of my hand if you're afraid.	Agarra a minha mão se tens medo.
Tom almost began to cry.	O Tom quase começou a chorar.
I cannot see the stars. It's cloudy.	Não consigo ver as estrelas; está nublado.
Should I call you a cab?	Queres que te chame um táxi?
No one is born wise, but many die stupid.	Ninguém nasce sábio, mas muitos morrem tolos.
Tom never forgave Mary for what she did.	O Tom nunca perdoou a Mary pelo que ela fez.
Don't try to frighten me.	Não tentes assustar-me.
But he was lucky.	Mas ele teve sorte.
If they need me, I'll be here.	Se precisarem de mim, estarei aqui.
That is his house.	Aquela é a casa dele.
I have to study.	Tenho de estudar.
Jim Carrey is very famous and a good comedian.	O Jim Carrey é muito famoso e um bom comediante.
I can't afford to buy anything that expensive.	Não tenho condições para comprar algo tão caro.
I wonder if Tom really wants to buy one of those.	Pergunto-me se o Tom realmente quer comprar um daqueles.
Tom wasn't with Mary.	O Tom não estava com a Mary.
Tom spent the night at his grandparents'.	O Tom passou a noite em casa dos avós.
Tom won't pass the test.	O Tom não vai passar no exame.
While demographer Klineberg sees Houston's demographic changes as inevitable, he wonders about how the city—and the country—will eventually handle them.	Embora o demógrafo Klineberg considere inevitáveis as mudanças demográficas em Houston, questiona como é que a cidade — e o país — acabarão por lidar com elas.
I oppose it.	Eu oponho-me a isso.
They changed the photo.	Mudaram a fotografia.
Both Tom and Mary are conservative.	Tanto o Tom como a Mary são conservadores.
Nobody is in the living room, but the TV is on.	Não está ninguém na sala, mas a televisão está ligada.
That wouldn't be the house we're looking for, surely.	Aquela não seria a casa de que estamos à procura, com certeza.
I'm pretty sure that Tom won't cancel the meeting.	Tenho quase a certeza de que o Tom não vai cancelar a reunião.
I'm tired of playing this game.	Estou cansado de jogar este jogo.
He can stay here for one night, no longer.	Ele pode ficar aqui apenas uma noite.
I don't think Tom knows he shouldn't do that here.	Não acho que o Tom saiba que não deve fazer isso aqui.
Are you ready to party?	Estás pronto para a festa?
I'm not religious in the normal sense. I believe the universe is governed by the laws of science. The laws may have been decreed by God, but God does not intervene to break the laws.	Não sou religioso no sentido habitual. Creio que o universo é regido pelas leis da ciência. As leis podem ter sido decretadas por Deus, mas Deus não intervém para as quebrar.
Do you want to go swimming with us?	Queres ir nadar connosco?
Can you tell me?	Podes dizer-me?
Your sincerity makes me happy.	A tua sinceridade deixa-me contente.
Please adjust the television picture.	Por favor, ajusta a imagem da televisão.
There's a bus stop right in front of my house.	Há uma paragem de autocarro mesmo à frente da minha casa.
In other words, the definition in rural communities of what it means to be poor is at variance with definitions used by the government.	Por outras palavras, a definição de pobreza nas comunidades rurais difere daquela usada pelo governo.
That could literally ruin my life.	Isso podia literalmente arruinar a minha vida.
I'll be back as soon as I find Tom.	Voltarei assim que encontrar o Tom.
This is Tom, my ex-boyfriend.	Este é o Tom, o meu ex-namorado.
I'm sure I'll regret this.	Tenho a certeza de que me vou arrepender disto.
Mary put on her new shoes.	A Mary calçou os seus sapatos novos.
We're trying to save Tom's life.	Estamos a tentar salvar a vida do Tom.
Nothing good came out of it.	Dali não saiu nada de bom.
I offered to lend money to her.	Eu ofereci-me para lhe emprestar dinheiro.
I've postponed my trip to Australia.	Eu adiei a minha viagem para a Austrália.
Before deciding, I would like to consult with my family.	Antes de decidir, gostava de falar com a minha família.
Tom told Mary that he was discouraged.	O Tom disse à Mary que estava desanimado.
I'm going to take a look outside.	Vou dar uma vista de olhos lá fora.
Time passes, time flies... and life is nothing more than a dream.	O tempo passa, o tempo voa... e a vida não passa de um sonho.
Let us all take off our masks and be frank one to another.	Tiremos todos as máscaras e sejamos francos uns com os outros.
Tom's parents live in an old trailer.	Os pais do Tom vivem numa caravana velha.
I don't feel like having Chinese food today.	Hoje não me apetece comer comida chinesa.
Tom is drunk again.	O Tom está bêbedo outra vez.
There's just one chair left.	Só resta uma cadeira.
Go ahead, I dare you!	Avança, desafio-te!
These are probably yours.	Estes devem ser teus.
I don't think that TV will ever take the place of books.	Não acho que a televisão vá substituir os livros.
Tom can't go to the art museum with us today.	O Tom não pode ir ao museu de arte connosco hoje.
Just reading the medicine made the cough go away.	Bastou ler a bula do medicamento para a tosse desaparecer.
I'll show you the town.	Vou mostrar-te a cidade.
My brother became an engineer.	O meu irmão tornou-se engenheiro.
Come on, tell us the whole story!	Vá lá, conta-nos a história toda!
Will I see her again?	Será que voltarei a vê-la?
Britain's fertility regulator has granted its first license for the genetic modification of human embryos for research into the causes of infertility and miscarriages.	A autoridade britânica de regulação da fertilidade concedeu a sua primeira licença para a modificação genética de embriões humanos para investigação das causas de infertilidade e abortos espontâneos.
Tom knew Mary was going to be mad at him.	O Tom sabia que a Mary ficaria zangada com ele.
Tom and Mary started talking at the same time.	O Tom e a Mary começaram a falar ao mesmo tempo.
It was really horrible.	Foi mesmo horrível.
I am not a student.	Eu não sou estudante.
Don't turn the light off.	Não apagues a luz.
That beef is very tender. It just melts in your mouth.	Essa carne de vaca está muito tenra; desfaz-se na boca.
I've already got a place to live.	Já arranjei onde morar.
Prices will continue to rise.	Os preços continuarão a subir.
I've been trying to explain to Tom that he can't keep coming in here without permission.	Tenho tentado explicar ao Tom que não pode continuar a entrar aqui sem autorização.
Don't bring bad luck.	Não tragas azar.
Death is scary.	A morte é assustadora.
Tom couldn't get Mary off his mind.	O Tom não conseguia tirar a Mary da cabeça.
I was on my way home.	Estava a caminho de casa.
Tom wants to change.	O Tom quer mudar.
Please lend me the video when you have seen it.	Por favor, empresta-me o vídeo quando o tiveres visto.
The girl in a white uniform took my temperature.	A rapariga de uniforme branco tirou a minha temperatura.
I had met her many times before then.	Já a tinha visto muitas vezes antes disso.
I'm here for personal reasons.	Estou aqui por motivos pessoais.
I had to give them the 411 on the situation.	Tive de lhes dar todas as informações sobre a situação.
We aren't scared of anyone.	Não temos medo de ninguém.
Tom made Mary cry.	O Tom fez a Mary chorar.
Tom is likely to die tonight.	É provável que o Tom morra esta noite.
I had to postpone my appointment.	Tive de adiar a minha marcação.
It is necessary that the halls be well cleaned.	É necessário que as janelas sejam bem limpas.
Thanks a lot for helping me today.	Muito obrigado por me ajudares hoje.
We'll have so much fun.	Vamos divertir-nos imenso.
The diplomatic feud between Saudi Arabia and Canada, triggered by a tweet criticizing the Gulf kingdom's human rights record, looks set to worsen this week with the suspension of direct Saudi flights to Canada.	A rixa diplomática entre a Arábia Saudita e o Canadá, desencadeada por um tuíte a criticar o historial de direitos humanos do reino do Golfo, parece prestes a agravar-se esta semana com a suspensão dos voos diretos sauditas para o Canadá.
The woodcutter fells a tree with an ax.	O lenhador corta a árvore com o machado.
Please tell me how to get to the bank.	Por favor, diga-me como chegar ao banco.
I rode a unicycle today.	Hoje andei de monociclo.
I hope Tom is here.	Espero que o Tom esteja aqui.
Why does the world contain only baths for the body, not for the soul?	Porque é que o mundo contém apenas banhos para o corpo, e não para a alma?
I'm not surprised that Tom wanted to do that.	Não me surpreende que o Tom quisesse fazer aquilo.
I wanted to move to Boston.	Eu queria mudar-me para Boston.
Tom wants to be popular.	O Tom quer ser popular.
I love the sound of wind chimes.	Adoro o som dos carrilhões de vento.
If the lights go out, light a candle.	Se faltar luz, acende uma vela.
That's the way it works.	É assim que isto funciona.
Food wastage is a serious problem.	O desperdício de alimentos é um problema grave.
Tom is a licensed real estate agent.	O Tom é agente imobiliário licenciado.
People could have avoided many mistakes by simple experiments.	As pessoas poderiam ter evitado muitos erros através de experiências simples.
If you like beer, you might like wine.	Se gostas de cerveja, talvez gostes de vinho.
Have the neighbors complained?	Os vizinhos queixaram-se?
Someone should tell her.	Alguém deveria dizer-lhe.
We speak the same language, don't we?	Nós falamos a mesma língua, não é?
We admire you.	Admiramos-te.
You're looking too close to the original. Put something else on.	Estás muito colada ao original. Veste outra coisa.
Have you ever lived in a rural area?	Alguma vez moraste numa zona rural?
These gases can lead to global warming.	Estes gases podem levar ao aquecimento global.
It's time for us to start thinking about how we can improve the situation.	É altura de começarmos a pensar em como podemos melhorar a situação.
Do everything at your own risk.	Faz tudo por tua própria conta e risco.
Tom is able to swim well.	O Tom sabe nadar bem.
Why don't you just tell me what you want me to do?	Porque é que não me dizes simplesmente o que queres que eu faça?
I wouldn't let that bother you.	Eu não deixaria que isso te incomodasse.
My grandfather loved reading.	O meu avô adorava ler.
Tom never hesitated.	O Tom nunca hesitou.
Tom went back to bed.	O Tom voltou para a cama.
She really wants to see you.	Ela quer muito ver-te.
Tell me your name.	Diz-me o teu nome.
Katya is ironing laundry with the new iron that Sasha gave her.	A Katya está a passar a roupa com o novo ferro que o Sasha lhe ofereceu.
Come on, drinks are on me.	Vá lá, eu pago as bebidas.
I had to fire Tom.	Tive de despedir o Tom.
You should be careful in crossing the street.	Deves ser cauteloso ao atravessar a rua.
Layla thought Sami had money.	A Layla pensou que o Sami tivesse dinheiro.
I let Tom kiss me.	Deixei o Tom beijar-me.
We have ten head of livestock.	Temos dez cabeças de gado.
Tom has it.	O Tom tem-no.
We closed the restaurant three years ago.	Fechámos o restaurante há três anos.
Somebody has to tell Tom what happened.	Alguém tem de explicar ao Tom o que sucedeu.
There's only one road on the island.	Há apenas uma estrada na ilha.
We'll meet again this afternoon.	Voltar-nos-emos a ver esta tarde.
Why don't we cancel the party?	Porque é que não cancelamos a festa?
This house was built a year ago.	Esta casa foi construída há um ano.
Don't eat before going to bed.	Não comas antes de ires para a cama.
I intend to decline his offer to help me.	Pretendo recusar a oferta dele para me ajudar.
Smoking is not good for one's health.	Fumar faz mal à saúde.
I hate garlic.	Odeio alho.
I don't think that Tom is involved.	Não acho que o Tom esteja metido nisto.
I have a pink car.	Tenho um carro cor-de-rosa.
I told Tom why I didn't want to do that.	Disse ao Tom porque é que não queria fazer aquilo.
That sounds good to me.	Parece-me bem.
Tom refused to pay the taxi cab driver.	O Tom recusou-se a pagar o condutor do táxi.
The murderer took the weapon with him.	O assassino levou a arma consigo.
My house is small.	A minha casa é pequena.
Tom had never kissed a girl before he kissed Mary.	O Tom nunca tinha beijado uma rapariga antes de beijar a Mary.
We all jumped into the water at the same time.	Saltámos todos para a água ao mesmo tempo.
Idleness is the devil's workshop.	A ociosidade é a oficina do diabo.
What tires us, above all, is understanding. Living is not thinking.	O que mais nos cansa é compreender. Viver não é pensar.
Her fiancé gave her a very big ring.	O noivo ofereceu-lhe um anel enorme.
Tom doesn't believe anything Mary says.	O Tom não acredita em nada do que a Mary diz.
What makes a flame blue?	O que é que torna uma chama azul?
Tom has a Canadian girlfriend.	O Tom tem uma namorada canadiana.
We only have three options.	Temos apenas três opções.
You will feel the happiest person in the world.	Sentir-te-ás a pessoa mais feliz do mundo.
He is not equal to his father.	Ele não está à altura do pai.
They say it will rain.	Diz-se que vai chover.
He never loses his head.	Ele nunca perde a cabeça.
I drank a beer.	Beber uma cerveja.
Because I didn't know what to do, I asked him for advice.	Como não sabia o que fazer, pedi-lhe um conselho.
Tom is the father of the bride.	O Tom é o pai da noiva.
What was she doing here?	O que é que ela fazia aqui?
This doesn't fit.	Isto não cabe.
I know what to do.	Sei o que fazer.
Who invited Tom to the party?	Quem convidou o Tom para a festa?
I could probably get used to having Tom for a son-in-law.	Provavelmente habituar-me-ia a ter o Tom como genro.
My socks are still damp.	As minhas meias ainda estão húmidas.
I came here with my mom.	Vim aqui com a minha mãe.
Balancing himself on the tail of a comet, the astronaut explored the Milky Way.	Equilibrando-se na cauda de um cometa, o astronauta explorou a Via Láctea.
Are you calling from Australia?	A senhora está a telefonar da Austrália?
Sami bought a penthouse in Cairo.	O Sami comprou um penthouse no Cairo.
Tom and Mary have both read a lot of books in French.	Tanto o Tom como a Mary leram muitos livros em francês.
Tom decided not to tell Mary this.	O Tom decidiu não contar isto à Mary.
We might have to hire some new waiters.	Talvez tenhamos de contratar novos empregados de mesa.
Take a good look.	Dá uma boa olhadela.
Are you going to help me find it?	Vais ajudar-me a encontrá-lo?
Fadil got an airtight alibi.	O Fadil tinha um álibi à prova de bala.
Give me one good reason.	Dá-me uma boa razão.
I'm pretty used to people not liking me.	Estou habituado a que as pessoas não gostem de mim.
Punctuation is important.	A pontuação é importante.
Tom seems to be determined to win.	O Tom parece determinado a vencer.
Fadil wanted to incinerate Layla's body.	O Fadil queria incinerar o corpo da Layla.
You saved my life.	Salvaste-me a vida.
Germany wanted Russia to stay out of the war.	A Alemanha queria que a Rússia se mantivesse fora da guerra.
Where have you been all morning?	Onde estiveste a manhã inteira?
Tom bought the cheapest thing in the store.	O Tom comprou o artigo mais barato da loja.
I want my children to have the best of everything.	Quero que os meus filhos tenham o melhor de tudo.
Tom cooked dinner.	O Tom preparou o jantar.
A thing doesn't please God because it is good; rather, because it pleases God, it is good.	Uma coisa não agrada a Deus por ser boa; é boa porque agrada a Deus.
I think that we have to go now.	Acho que temos de ir agora.
Tom is already halfway to Boston.	O Tom já está a meio caminho de Boston.
I never spoke French when I was a child.	Nunca falei francês quando era criança.
Tom called Mary.	O Tom ligou à Mary.
In the last year, it's become possible for visitors to hop over the churning waves and set foot on one historic offshore lighthouse.	No último ano, tornou-se possível aos visitantes saltar por cima das ondas revoltas e pisar um farol histórico situado em alto-mar.
The greatest difficulty of all is the unwillingness.	A maior dificuldade de todas é a falta de vontade.
Love all, trust a few, do wrong to none.	Ama todos, confia em poucos, não faças mal a ninguém.
I woke up next to a strange woman.	Acordei ao lado de uma mulher estranha.
I wish I had more money.	Gostava de ter mais dinheiro.
What keeps you up at night?	O que é que te mantém acordado à noite?
Above all, children need love.	Acima de tudo, as crianças precisam de amor.
Please show me that letter.	Por favor, mostra-me essa carta.
I met her along the way to school.	Encontrei-a no caminho para a escola.
I will have finished my homework by Tuesday.	Eu terei terminado o meu trabalho de casa na terça-feira.
Tom didn't have time to do everything that Mary asked him to.	O Tom não teve tempo para fazer tudo o que a Mary lhe pediu.
Tom read the letter over and over again.	Eu vi o Tom reler a carta várias vezes.
We haven't told Tom yet.	Ainda não contámos ao Tom.
She let us know she couldn't do that.	Ela fez-nos saber que não podia fazer isso.
Tom will never believe me again.	O Tom nunca mais vai acreditar em mim.
All is completed with this.	Com isto está tudo complete.
This colourful dress will suit you, with your slim figure, very well.	Este vestido colorido vai assentar-te muito bem, com a tua silhueta esbelta.
Tom is looking forward to Christmas.	O Tom está ansioso pelo Natal.
We were driven to the wall.	Fomos levados para a parede.
We advanced the date of the meeting.	Adiantamos a data da reunião.
My brother hates me.	O meu irmão odeia-me.
Lightning normally accompanies thunder.	Os relâmpagos normalmente acompanham o trovão.
You're sick. You have to rest.	Estás doente, precisas de descansar.
Each student has their own computer.	Cada estudante tem o seu próprio computador.
God has sent his angels to protect you wherever you go.	Deus enviou os seus anjos para te protegerem onde quer que vás.
Mary is one of the prettiest girls I know.	A Mary é uma das raparigas mais bonitas que conheço.
I shouldn't have gone to Boston without you.	Não devia ter ido a Boston sem ti.
Tom helped me milk the cows.	O Tom ajudou-me a ordenhar as vacas.
I reckon something scared him.	Acho que algo o assustou.
The nurse soothed the crying child.	A enfermeira acalmou a criança que estava a chorar.
Tom told everybody he was lonely.	O Tom disse a toda a gente que estava sozinho.
We've all seen that before.	Já todos vimos isso antes.
That is the girl who waited on me in the shop yesterday.	Aquela é a rapariga que me atendeu na loja ontem.
His triumphant entry amazed everyone.	A sua entrada triunfal surpreendeu toda a gente.
I told you to stay away from my sister.	Eu disse-te para ficares longe da minha irmã.
Fadil was more experienced than Rami at the time.	O Fadil era mais experiente do que o Rami na altura.
I'll show you the city.	Eu vou mostrar-te a cidade.
A century of digging for gold has created a silhouette of mine dumps all around the South African city of Johannesburg.	Um século de exploração aurífera criou uma silhueta de pilhas de rejeitos mineiros em redor da cidade sul-africana de Joanesburgo.
The sound woke her up.	O som acordou-a.
What part of Canada are you from?	De qual parte do Canadá vens?
The hiker has reached the top of the mountain.	O caminhante alcançou o cume da montanha.
He has a habit of telling lies.	Ele tem o hábito de mentir.
