Don't forget to call me.	Não se esqueçam de me ligar.
Sami admitted he had been having an affair with both girls.	O Sami admitiu que tinha um caso com ambas as raparigas.
He doesn't feel anything.	Ele não sente nada.
Without your help this plan would be impossible.	Sem a tua ajuda, este plano seria impossível.
Tom would never have hurt you.	O Tom nunca te teria magoado.
Was it that obvious?	Foi assim tão óbvio?
We've been having marital problems.	Temos tido problemas conjugais.
You'll miss me.	Vais sentir a minha falta.
The honeymoon is over.	A lua-de-mel acabou.
Justice always comes, sooner or later.	A justiça pode tardar, mas acaba por chegar.
We can't leave this here.	Não podemos deixar isto aqui.
I always add a spoonful of honey to my tea.	Costumo pôr uma colher de mel no chá.
Tom isn't lonely anymore.	O Tom já não está sozinho.
His death was a great loss to our country.	A morte dele foi uma grande perda para o nosso país.
Fadil found the house without difficulty.	O Fadil encontrou a casa sem dificuldade.
I think this is a very unfair debate.	Acho que este debate é muito injusto.
She will be here this evening.	Ela estará cá esta noite.
Tom is in a meeting.	O Tom está numa reunião.
How about playing chess tonight?	Que tal jogarmos xadrez esta noite?
The next meeting will be on the tenth of June.	A próxima reunião será a dez de junho.
Tom got nothing.	O Tom não conseguiu nada.
I'm strange.	Sou estranho.
Tom sent his daughter to bed without dinner.	O Tom mandou a filha para a cama sem jantar.
But the Japanese also relish pizzas topped with corn or squid, hamburgers smothered in mayonnaise and wasabi, or chowder brimming with tofu — that is to say, fermented soybean curd.	Mas os japoneses também apreciam pizzas cobertas com milho ou chocos, hambúrgueres com muita maionese e wasabi, ou sopas cremosas repletas de tofu — isto é, coalhada de soja fermentada.
Foam is white.	A espuma é branca.
The disease was caused by a new micro-organism.	A doença foi causada por um novo micro-organismo.
Tom told Mary he wouldn't win.	O Tom disse à Mary que não ia ganhar.
Tom witnessed the whole thing.	O Tom testemunhou tudo.
Tom finally went to Boston last summer.	O Tom finalmente foi a Boston no verão passado.
Anyway, how can I help you?	De qualquer forma, como lhe posso ajudar?
I named the kitten Cookie.	Chamei Cookie ao gatinho.
Japanese isn't like Chinese at all, even though both languages are Asian.	O japonês não se assemelha ao chinês, embora ambas as línguas sejam asiáticas.
I've got to show you something.	Tenho de te mostrar uma coisa.
Do you believe in ghosts?	Tu acreditas em fantasmas?
I feel like a walk. Wanna come along?	Apetece-me dar uma volta. Queres vir comigo?
An air mattress may not be the most comfortable thing to sleep on, but it's much better than the floor.	Um colchão insuflável pode não ser a coisa mais confortável para dormir, mas é muito melhor do que o chão.
The shop also offers the full range of sacred hardware — and all these chalices and crucifixes and tabernacles are worth a pretty penny.	A loja também oferece toda uma gama de objetos sagrados — e todos estes cálices, crucifixos e tabernáculos valem uma boa quantia.
Luck plays an important role in our life.	A sorte desempenha um papel importante na nossa vida.
The new medicine saved me from an illness.	O novo medicamento livrou-me da doença.
Tom wears an eyepatch.	O Tom usa uma pala no olho.
Ask Tom.	Pergunta ao Tom.
We never voted.	Nunca votámos.
Tom respects everyone.	O Tom respeita toda a gente.
I could stay in Australia for another two or three weeks if you need me here.	Poderia ficar na Austrália mais duas ou três semanas se precisarem de mim aqui.
Give me the book.	Dá-me o livro.
He had the kindness to find me a job.	Ele teve a gentileza de me arranjar um trabalho.
“The European Union this week launched a $340 billion “Global Gateway” fund to boost global infrastructure, which analysts say is aimed at rivaling China's Belt and Road Initiative.”	A União Europeia lançou esta semana um fundo “Global Gateway” de 340 mil milhões de dólares para reforçar infraestruturas mundiais, que, segundo analistas, pretende rivalizar com a Iniciativa Belt and Road da China.
Tom, I have something to say to you.	Tom, tenho algo a dizer-te.
I'm in the middle of something. Can I call you back?	Estou a meio de algo. Posso voltar a ligar-te?
Tom kept telling Mary lies.	O Tom continuou a contar mentiras à Mary.
The government rationed meat during the war.	O governo racionou a carne durante a guerra.
Do you see your table?	Vês a tua mesa?
The door to the house is closed, but the windows are open.	A porta da casa está fechada, mas as janelas estão abertas.
Among the food crops that can be made into fuels are: maize, palm trees, sugarcane, beetroot, wheat, groundnuts, pumpkin, sesame and cotton seeds, and the woody shrub called jatropha.	Entre as culturas alimentares que podem ser transformadas em biocombustíveis incluem-se: o milho, as palmeiras, a cana-de-açúcar, a beterraba, o trigo, o amendoim, a abóbora, o sésamo, as sementes de algodão e o arbusto lenhoso chamado jatrofa.
I didn't sign anything.	Não assinei nada.
Tom loves playing football.	O Tom adora jogar futebol americano.
As for me, I like this better.	Quanto a mim, gosto mais deste.
I'll see you after class.	Vejo-te depois da aula.
The fact that you can add it on fruit salads, throw it in your gazpacho or use it to garnish a drink is a nice bonus.	O facto de se poder adicioná-lo a saladas de fruta, misturá-lo no gaspacho ou usá-lo para guarnecer uma bebida é um bónus agradável.
As most big-city dwellers know, parking in public garages during a busy weekday can be very frustrating.	Como sabem a maioria dos habitantes de grandes cidades, estacionar em garagens públicas num dia útil movimentado pode ser muito frustrante.
She grabbed me by the ears and had me go to the beautician.	Ela agarrou-me pelas orelhas e levou-me à esteticista.
The boy saw his father dying.	O rapaz viu o pai morrer.
Do you have a hunting license?	Tens licença de caça?
Tom advised us not to go.	O Tom aconselhou-nos a não ir.
They say red wine is better with meat than white.	Dizem que o vinho tinto acompanha melhor a carne do que o branco.
Is that train fast?	Aquele comboio é rápido?
That's the key.	Essa é a chave.
I just wanted to teach you a lesson.	Só te queria dar uma lição.
There is no denying that English is the most widely spoken language in the world.	Não há como negar que o Inglês é a língua mais falada do mundo.
Think of your future.	Pensa no teu futuro.
The box isn't empty.	A caixa não está vazia.
He is fond of fishing.	Ele gosta muito de pescar.
Tell me your address.	Diz-me o teu endereço.
Would you please open the door for me?	Podes abrir-me a porta, por favor?
What is it that we have to do?	O que é que temos de fazer?
I hurt my back.	Magoei as costas.
He is terribly jealous.	Ele é terrivelmente ciumento.
That might lead to something.	Isso pode levar a alguma coisa.
Don't touch anything.	Não toquem em nada.
Cyber experts say hundreds of thousands of viruses and malware bombard personal computers every day.	Especialistas em cibersegurança dizem que centenas de milhares de vírus e malware bombardeiam computadores pessoais todos os dias.
Mary was acting irrationally.	A Mary estava a agir irracionalmente.
They all envied my new car.	Todos eles invejaram o meu carro novo.
Is this beef or pork?	Isto é vaca ou porco?
Anyone would've done the same thing.	Qualquer um teria feito o mesmo.
I want to see you as soon as possible.	Quero ver-te o mais depressa possível.
People often refer to themselves in the third person when talking to children.	As pessoas referem-se frequentemente a si próprias na terceira pessoa quando falam com crianças.
I think this is the best way to do it.	Acho que esta é a melhor forma de o fazer.
How would you describe yourself?	Como te descreverias?
I opened the box and it was empty.	Abri a caixa e ela estava vazia.
I'm going to do this by myself.	Vou fazer isto sozinho.
I had to know more.	Eu tinha que saber mais.
Those who pelt stones will be dealt with sternly.	Aqueles que atiram pedras serão severamente punidos.
He arrived at the station.	Ele chegou à estação.
We have a small house.	Temos uma casa pequena.
Louisiana has been hardest hit by the disaster, but oil residue is continuing to spread elsewhere in the Gulf to fragile coastlines, coating wildlife in a black ooze and threatening the livelihoods of fishermen and other business owners.	A Louisiana foi a mais afetada pelo desastre, mas os resíduos de petróleo continuam a espalhar-se pelo Golfo até às frágeis zonas costeiras, cobrindo a vida selvagem com um lodo negro e ameaçando a subsistência de pescadores e outros empresários.
We've decided to move the meeting to next Sunday.	Decidimos adiar a reunião para o próximo domingo.
I think she's from Austria.	Acho que ela é austríaca.
Tom isn't even here.	O Tom nem sequer está cá.
Tom's room is dirty.	O quarto do Tom está sujo.
Don't yell at my kid.	Não grites com a minha filha.
She will be 20 next month.	Ela faz 20 anos no próximo mês.
There is a plane above the church.	Há um avião sobre a igreja.
Fearing “deadly consequences,” human rights groups in the Philippines have expressed dismay after the Supreme Court upheld most provisions of the anti-terror law, which they say is detrimental to the country's democracy as it threatens human rights.	Temendo “consequências mortais,” grupos de direitos humanos nas Filipinas manifestaram desânimo depois de o Supremo Tribunal manter a maioria das disposições da lei antiterrorista, que, afirmam, prejudica a democracia ao ameaçar os direitos humanos.
Please visit us.	Visita-nos, por favor.
Her lips were sweet.	Os lábios dela eram doces.
Call security!	Chamem a segurança!
One New York City Park is getting some non-human help maintaining its green space this week, as a herd of goats has been brought in to help trim the lawn.	Um parque de Nova Iorque está a receber ajuda não-humana na manutenção do seu espaço verde esta semana, pois foi trazido um rebanho de cabras para aparar a relva.
Just sit in the back.	Apenas senta-te lá atrás.
I think we can begin.	Acho que podemos começar.
According to the paper, there was an earthquake last night.	Segundo o jornal, houve um terramoto ontem à noite.
In India, the government says it will focus on infrastructure development and on boosting investment as it proposes a slew of measures to propel the economy on a high growth path.	Na Índia, o governo afirma que se irá concentrar no desenvolvimento de infraestruturas e no incremento dos investimentos, propondo uma série de medidas para impulsionar a economia numa trajetória de elevado crescimento.
I need not have watered the flowers. Just after I finished, it stared raining.	Eu não precisava de ter regado as flores. Assim que eu terminei, começou a chover.
Many people went to Tom's funeral.	Muita gente foi ao funeral do Tom.
Have you already met Mr Smith?	Tu já foste apresentada ao sr. Smith?
Austria is situated in Central Europe.	A Áustria situa-se na Europa Central.
They are Japanese sumo wrestlers.	Eles são lutadores de sumo japoneses.
I understand your concern.	Compreendo a tua preocupação.
The U.N. Children's Fund (UNICEF) reports a growing number of children in eastern part of the Democratic Republic of Congo orphaned by the Ebola outbreak in the region are at risk of stigmatization and abandonment.	O Fundo das Nações Unidas para a Infância (UNICEF) reporta que um número crescente de crianças na parte oriental da República Democrática do Congo, órfãs devido ao surto de Ébola na região, corre risco de estigmatização e abandono.
Masha prefers coffee without caffeine.	A Masha prefere café descafeinado.
Could you repeat the question, please?	Podes repetir a pergunta, por favor?
This dog saved the girl's life.	Este cão salvou a vida da rapariga.
The castle is worth visiting.	Vale a pena visitar o castelo.
It is the instability of Nitric Acid therefore—its proneness to part with Oxygen—which renders it superior to the Sulphuric and to most acids in dissolving Silver and various other substances, both organic and inorganic.	É a instabilidade do ácido nítrico—a sua tendência a libertar oxigénio—que o torna superior ao sulfúrico e à maioria dos ácidos na dissolução da prata e de várias outras substâncias, orgânicas e inorgânicas.
Hold it for me.	Segura-o para mim.
In an address Sunday on state television, the president announced a 30-day plan to ration electricity.	Num discurso emitido no domingo na televisão estatal, o presidente anunciou um plano de 30 dias para racionar eletricidade.
Could there be a language as beautiful as mine?	Pode existir língua tão bela quanto a minha?
Tom says he isn't willing to take any risks.	O Tom diz que não está disposto a correr quaisquer riscos.
I'm sure I never saw her before.	Tenho a certeza de que nunca a vi antes.
Alienation is a common theme of twentieth-century literature.	A alienação é um tema comum da literatura do século XX.
We shot pheasants by the hundred.	Matamos centenas de faisões a tiro.
Tom will be famous one day.	Um dia o Tom será famoso.
Good endurance is of great importance to the performance of many sports.	Uma boa resistência é de grande importância para o desempenho de muitos desportos.
Students tend to sit in the same seats every class.	Os alunos tendem a ocupar sempre os mesmos lugares em cada aula.
Tom never was ambitious.	O Tom nunca foi ambicioso.
Tom seemed like he was about to burst into tears any minute.	Parecia que o Tom ia desatar a chorar a qualquer momento.
Whose turn is it now?	De quem é agora a vez?
Don't explain anything to me.	Não expliques nada para mim.
We are going to hold a farewell party for him.	Vamos fazer-lhe uma festa de despedida.
I want to know all the details.	Quero saber todos os pormenores.
He adhered to his own theory.	Ele manteve-se fiel à sua própria teoria.
How long is the surgery?	Quanto tempo dura a cirurgia?
Because plants use water continuously, but in most places it rains only occasionally, the water-holding capacity of soils is essential for plant survival.	Como as plantas usam água continuamente, mas na maioria dos lugares chove só ocasionalmente, a capacidade de retenção de água dos solos é essencial para a sobrevivência das plantas.
Tom always sits in the back of the classroom.	O Tom senta-se sempre no fundo da sala.
Mary is going to write a letter.	A Mary vai escrever uma carta.
It's a wonderful trait to be able to not take yourself seriously.	É uma característica maravilhosa saber não se levar a sério.
Let's start the party.	Vamos começar a festa.
How are your grandparents? It has been a long time since I've seen them.	Como estão os teus avós? Há muito tempo que não os vejo.
If geometry is the science of space, what is the science of time?	Se a geometria é a ciência do espaço, qual será a ciência do tempo?
A territory, that is, a group of empty intersections is conquered by surrounding it on all four sides (top, bottom, right, and left).	Conquista-se um território — um grupo de interseções vazias — circundando-o pelos quatro lados (superior, inferior, direito e esquerdo).
We took the liberty of putting your candidacy on hold.	Tomámos a liberdade de pôr a sua candidatura em suspenso.
A person who likes no one is much sadder than someone whom no one likes.	Uma pessoa que não gosta de ninguém é muito mais triste do que alguém de quem ninguém gosta.
Why do we have to pay taxes?	Porque é que temos de pagar impostos?
Filipinos are not like Swiss.	Os filipinos não são como os suíços.
I think that we've seen enough.	Acho que já vimos o suficiente.
I plan to stay here for three days.	Planeio ficar aqui durante três dias.
Please stay calm, everyone.	Por favor, mantenham-se calmos.
I love Mary's perfume.	Adoro o perfume da Mary.
It's your loss.	É a tua perda.
Tom wanted to take a shower.	O Tom queria tomar um duche.
The company manufactures a wide variety of musical instruments.	A empresa produz uma grande variedade de instrumentos musicais.
You are a good customer.	Tu és um bom cliente.
While there are other certification systems farmers can access in Ghana, these are expensive processes and aimed at export markets, Benedict added.	Embora existam outros sistemas de certificação disponíveis para os agricultores no Gana, estes processos são dispendiosos e direcionados aos mercados de exportação, acrescentou Benedict.
Initially this gave rise to gossip among petty people, and it gradually provoked criticism from members of our family.	No início isso levou a boatos entre pessoas fúteis, e gradualmente provocou críticas aos membros da nossa família.
Is there a pattern here?	Há um padrão aqui?
Yesterday, I wrote a letter to my grandfather.	Ontem escrevi uma carta ao meu avô.
You know I won't say anything.	Sabem que não contarei nada.
It sounds like its being sold by the original builder here on eBay.	Parece que está a ser vendido pelo construtor original aqui no eBay.
I admit I didn't do what I promised to do.	Admito que eu não fiz o que prometi fazer.
The small skirt is pink.	A saia pequena é cor-de-rosa.
Tom took his shirt off.	O Tom tirou a camisa.
She whispered something into his ear.	Ele sussurou-lhe algo ao ouvido.
A poor man misses many things, but a miser misses everything.	Ao pobre faltam muitas coisas, mas ao avarento falta tudo.
I wish I could prevent that.	Quem me dera poder impedir isso.
Sign up to join our WhatsApp Group.	Inscreve-te para te juntares ao nosso grupo de WhatsApp.
Blood flows through blood vessels.	O sangue flui através dos vasos sanguíneos.
There must be something we can do.	Deve haver algo que possamos fazer.
This doll is a gift from my aunt.	Essa boneca é um presente da minha tia.
Tom won't buy anything.	O Tom não vai comprar nada.
He may have seen it.	Ele talvez o tivesse visto.
Pardon me for not getting back to you sooner.	Desculpa não ter respondido antes.
Among other things, we talked about the weather.	Entre outras coisas, falámos sobre o tempo.
We haven't done anything together in weeks.	Não temos feito nada juntos há semanas.
Let me know if anything strange happens.	Avisa-me se acontecer algo estranho.
Remember what I told you before.	Lembra-te do que te disse antes.
Tom already has a new girlfriend.	O Tom já tem outra namorada.
Guess what that cost me.	Adivinha quanto é que isso me custou.
Tom was never in Boston.	O Tom nunca esteve em Boston.
Give thanks to the Lord for the blessing of life.	Agradece ao Senhor pela bênção da vida.
Discussion is based upon mutual respect.	Uma discussão baseia-se no respeito mútuo.
This place is fabulous.	Este lugar é fabuloso.
I was expecting to find Tom here.	Eu esperava encontrar Tom aqui.
I've been to Paris twice.	Já estive em Paris duas vezes.
The United Nations calls 2007 a wretched year for millions of disaster victims.	As Nações Unidas classificam 2007 como um ano miserável para milhões de vítimas de catástrofes.
I've seen the picture before.	Já vi a fotografia antes.
They only wanted to ask me a few questions.	Eles só queriam fazer-me algumas perguntas.
Those two Russian sisters are married to two Polish brothers.	Aquelas duas irmãs russas são casadas com dois irmãos polacos.
Sami studied Arabic for one year.	O Sami estudou árabe durante um ano.
It's way too cold to swim.	Está frio demais para nadar.
She asked him for some money to buy a new dress.	Ela pediu-lhe dinheiro para comprar um vestido novo.
There's not a living soul around here.	Não há uma alma viva por aqui.
Wang also sought to remind Myanmar of China's steadfast support ahead of a new U.S. administration expected to pay more attention to a region the two superpowers are vying to influence, they add.	Wang procurou ainda lembrar Mianmar do apoio inabalável da China, na expectativa de uma nova administração norte-americana que deverá dedicar mais atenção à região que as duas superpotências disputam influenciar, acrescentam.
Tom's house has only one bedroom.	A casa do Tom tem apenas um quarto.
Such painters as Picasso are rare.	São raros os pintores como Picasso.
Tom was arrested for driving without a license.	O Tom foi preso por conduzir sem carta.
It's in my jacket pocket.	Está no bolso do meu casaco.
Tom quietly closed the bedroom door.	O Tom fechou silenciosamente a porta do quarto.
Germany today is different; not just white people speak German.	A Alemanha de hoje é diferente; não são só pessoas brancas que falam alemão.
I have locked myself out of my room.	Fechei-me fora do quarto.
Tom never left the house.	O Tom nunca saiu de casa.
The police fired directly into the crowd.	A polícia disparou diretamente contra a multidão.
It just wasn't meant to be.	Simplesmente não era para ser.
Tom wanted to give Mary something special on their anniversary.	O Tom queria dar à Mary algo especial no aniversário deles.
Everything will be perfect.	Tudo vai ser perfeito.
Tom seems to be all right.	O Tom parece bem.
Can you teach me Portuguese?	Podes ensinar-me português?
I was able to answer all the questions.	Consegui responder a todas as perguntas.
During the night, a wasp stung me in the temple.	Durante a noite, uma vespa picou-me na têmpora.
My mother said that she was all right.	A minha mãe disse que estava bem.
I heard Tom tap dancing.	Ouvi o Tom a sapatear.
I just didn't know what to say.	Simplesmente não soube o que dizer.
The overall mood was particularly cordial, much more cordial than the earlier meetings, which have been cordial enough, but this one was particularly cordial.	O ambiente geral era particularmente cordial, muito mais do que nas reuniões anteriores, que já haviam sido cordiais, mas esta foi especialmente afável.
My older sister is a volunteer firefighter.	A minha irmã mais velha é bombeira voluntária.
Please stop whistling.	Por favor, para de assobiar.
Life can be fun.	A vida pode ser divertida.
He was discouraged to hear that.	Ao ouvir isso ele ficou desanimado.
Life's nature is cyclic.	A vida é, por natureza, cíclica.
Where's my stuff?	Onde estão as minhas coisas?
In medieval times, empiricists were often considered charlatans.	Na Idade Média, os empiristas eram muitas vezes considerados charlatães.
Tom used to work as a freelance photographer.	O Tom costumava trabalhar como fotógrafo freelancer.
Tom sat on his father's lap.	O Tom sentou-se no colo do pai.
I gave up smoking six months ago.	Eu deixei de fumar há seis meses.
I wonder why Tom doesn't like Australia.	Pergunto-me porque é que o Tom não gosta da Austrália.
The door is made of steel.	A porta é feita de aço.
Mary sat on her bed crying.	A Mary sentou-se na cama a chorar.
We had a slight difference of opinion.	Nós temos uma pequena diferença de opinião.
Because of a flaw in the original design, our website is vulnerable to SQL injection attacks.	Devido a uma falha no desenho original, o nosso sítio está vulnerável a ataques de injeção SQL.
You're asking for it.	Estás a pagar por isso.
The judge sentenced him to one year's imprisonment.	O juiz condenou-o a um ano de prisão.
I wanted you to see me.	Queria que me visses.
Jim put his hand up.	O Jim levantou a mão.
Sami didn't change anything.	O Sami não mudou nada.
We were in the same class then.	Na altura estavamos na mesma turma.
The sapphire, azure gem that emulates heaven's loftly arch, shall gleam, and softly there the verdant emerald shed its greenest light, and fiery carbuncle flash forth its rosy rays from the pure gold.	A safira, gema azul-celeste que imita o arco altivo do céu, há de resplandecer, e suavemente aí a esmeralda verdejante derramará o seu mais verde fulgor, enquanto o ardente carbúnculo disparará raios rosados desde o ouro puro.
Thousands of farmers in India blocked highways and rail tracks on Monday to give renewed momentum to their months-long demand for scrapping agricultural laws that have triggered the country's longest farm protest and presented a political challenge to Prime Minister Narendra Modi.	Milhares de agricultores na Índia bloquearam autoestradas e linhas ferroviárias na segunda-feira para dar novo impulso ao seu protesto de meses pela revogação das leis agrícolas que desencadearam a mais longa greve de agricultores do país e colocaram um desafio político ao primeiro-ministro Narendra Modi.
The law was changed.	A lei foi alterada.
I'm sure I turned off the stove.	Estou certo de que desliguei o fogão.
It's not deep enough.	Não é suficientemente fundo.
Please call me Joe.	Chama-me Joe, por favor.
The discovery took place on a warm August day in 1896.	A descoberta deu-se num dia quente de agosto de 1896.
Today I went to the doctor.	Hoje fui ao médico.
Tom forgot his lunch box on his desk, but the teacher locked the classroom.	O Tom esqueceu-se da lancheira na carteira, mas a professora trancou a sala de aula.
The prickly pear cactus grows abundantly in many parts of northern Ethiopia's Tigray region.	A figueira-da-índia cresce abundantemente em muitas zonas do norte da Etiópia, na região de Tigré.
How many shopping bags do you have?	Quantos sacos de compras tens?
From the moment that I knew that the university existed, I've wanted to go there.	A partir do momento em que eu soube que a universidade existia, eu quis ir para lá.
Boston is the city where I was born.	Boston é a cidade onde nasci.
The prison was my university.	A prisão foi a minha universidade.
Tom has been over to your place, hasn't he?	O Tom já passou pela tua casa, não passou?
My friends are my family.	Os meus amigos são a minha família.
Tom started to snore.	O Tom começou a ressonar.
You won't win this game.	Tu não vais ganhar este jogo.
