They've been in France, Germany, Spain, Portugal, United States, Canada, and Porto Rico.	Elas estiveram em França, na Alemanha, Espanha, Portugal, Estados Unidos, Canadá e Porto Rico.
I have a terrible hangover.	Estou com uma ressaca terrível.
I'm lost. Could you please help me?	Estou perdida. Podes ajudar-me, por favor?
If the Americans win this contest and Honduras scores a home win or draw against Panama, the United States will clinch a 2014 World Cup berth.	Se os americanos vencerem este encontro e Honduras somar uma vitória ou empate em casa contra o Panamá, os Estados Unidos garantem a qualificação para o Mundial de 2014.
I spent Christmas with my family.	Passei o Natal com a minha família.
Tom opened the door for Mary.	O Tom abriu a porta à Mary.
Put it on my desk.	Põe-no na minha secretária.
Man, being of flesh, is subject to diseases of the mind and after death, to worms.	Sendo de carne, o homem está sujeito a doenças da mente e, depois de morto, aos vermes.
Tom asked Mary why she was late.	O Tom perguntou à Mary porque é que ela se atrasou.
Discover the 25 most powerful phrases for your communication.	Descobre as 25 frases mais poderosas para a tua comunicação.
Tom hopes that Mary won't find out the truth.	O Tom espera que a Mary não descubra a verdade.
If you can hear me, squeeze my hand.	Se me consegues ouvir, aperta-me a mão.
Tom did everything he had to do.	O Tom fez tudo o que tinha de fazer.
Ghana has started building seawalls at key points along its shore to stop coastal erosion and protect beaches, communities and historic buildings.	O Gana iniciou a construção de barreiras resistentes à água em pontos-chave ao longo da costa para travar a erosão costeira e proteger praias, comunidades e edifícios históricos.
Tom set the table for dinner while Mary cooked.	O Tom pôs a mesa para o jantar enquanto a Mary cozinhava.
This thread is thinner than a human hair.	Este fio é mais fino do que um cabelo humano.
No one likes me.	Ninguém gosta de mim.
I began to play clarinet when I was thirteen.	Comecei a tocar clarinete aos treze anos.
Tom did everything he had to do.	O Tom fez tudo o que ele tinha de fazer.
I'd like you to meet Tom, my cousin.	Gostaria que conhecesses o meu primo Tom.
Tom wasn't able to open the door.	O Tom não conseguiu abrir a porta.
Let him have fun.	Deixa-o divertir-se.
I have to brush up my French before I go to Paris to study.	Tenho de refrescar o meu francês antes de ir estudar em Paris.
Tom grilled the steak.	O Tom grelhou o bife.
This is Jane's bag.	Esta é a mala da Jane.
Life would be tragic if it weren't funny.	A vida seria trágica se não fosse divertida.
If Ted were here, he could help us clean our room.	Se o Ted estivesse aqui, ele podia ajudar-nos a limpar o nosso quarto.
In the United States there is a census every ten years.	Nos Estados Unidos, há um censo de dez em dez anos.
Prices continued to rise.	Os preços continuaram a subir.
What's your theory?	Qual é a tua teoria?
I remember seeing her somewhere.	Eu lembro-me de a ter visto em algum lado.
Tom probably doesn't remember what Mary looks like.	O Tom provavelmente não se lembra da aparência da Mary.
I asked Tom why he wanted this.	Eu perguntei ao Tom por que motivo queria isto.
Say hello to your mum for me.	Dá cumprimentos à tua mãe por mim.
Tom Jackson works here, doesn't he?	O Tom Jackson trabalha aqui, não trabalha?
He devoted himself to the study of medicine.	Ele dedicou-se ao estudo da medicina.
Tom couldn't unlock the door because he had the wrong key.	O Tom não conseguiu destrancar a porta porque tinha a chave errada.
People are rich here.	As pessoas aqui são ricas.
This music's annoying everyone.	Esta música está a irritar toda a gente.
If I was you, I wouldn't do such a thing.	No teu lugar, não faria uma coisa dessas.
He's always on time.	Ele está sempre a horas.
I'll do what I have to do.	Farei o que tiver de fazer.
My mother was very sick, but thank God, she's much better now.	A minha mãe esteve muito doente, mas graças a Deus já está muito melhor.
Let's start first with the ten main ways to make money online.	Vamos começar pelas dez principais formas de ganhar dinheiro online.
I'm not going to look.	Não vou olhar.
The project will be completed in less than three years.	O projeto ficará concluído em menos de três anos.
I'd like to live in the suburbs of Kobe.	Gostava de viver nos subúrbios de Kobe.
In its home country, France, Tatoeba became a social and cultural phenomenon.	No seu país de origem, França, o Tatoeba tornou-se um fenómeno cultural e social.
I never said no.	Nunca disse «não».
Tom and Mary kissed.	O Tom e a Mary beijaram-se.
We just visited Boston last month.	Visitámos Boston no mês passado.
Because of the dense haze, the road was hard to see.	Por causa da névoa densa mal se via a estrada.
I'm drinking a beer right now.	Estou a beber uma cerveja neste momento.
It must've been the day before Tom got here that I got up before dawn.	Deve ter sido no dia antes de o Tom chegar aqui que me levantei antes do amanhecer.
Mr. Knight began as a bobbin boy in a mill at Coventry, Rhode Island, in 1835.	O Sr. Knight começou como rapaz de bobinas numa fiaria em Coventry, Rhode Island, em 1835.
Tom came to our house uninvited.	O Tom veio A nossa casa sem ser convidado.
Mary wrote her phone number on a piece of paper and handed it to Tom.	A Mary escreveu o seu número de telefone num pedaço de papel e deu-o ao Tom.
I wonder if Tom is depressed.	Pergunto-me se o Tom está deprimido.
I only did what I had to do.	Só fiz o que tinha de fazer.
I should have listened to Mary.	Devia ter ouvido a Mary.
We've decided to postpone the meeting to next Sunday.	Decidimos adiar a reunião para o próximo domingo.
We're going to stay at home today.	Vamos ficar em casa hoje.
Have a look at the girls.	Dá uma olhadela às raparigas.
What's that restaurant's name?	Como se chama esse restaurante?
Cat Stevens is not a cat. He's a singer.	Cat Stevens não é um gato; é um cantor.
Tom drives a red sports car.	O Tom conduz um carro desportivo vermelho.
Tom says he understands how Mary feels.	O Tom diz que compreende como a Mary se sente.
He sat down by my side.	Ele sentou-se ao meu lado.
The fire had already gone out by the time the fire truck arrived.	O incêndio já se tinha extinguido quando o camião de bombeiros chegou.
I wasn't even here.	Eu nem sequer estava aqui.
I went to Boston in the summer.	Fui a Boston este verão.
Don't be a bad boy.	Não sejas um menino mau.
We heard the sound of gunshots.	Ouvimos o som dos tiros.
Behind closed doors, Fadil's true nature is revealed.	Atrás de portas fechadas, revela-se a verdadeira natureza do Fadil.
Tom's father never came back home before nine or ten.	O pai do Tom nunca voltava para casa antes das nove ou dez.
One of them is an actor, who is going to pretend to murder someone.	Um deles é um ator que vai fingir que mata alguém.
Merry Christmas.	Feliz Natal.
We're going to play tennis.	Vamos jogar ténis.
I'm not sentimental—I'm as romantic as you are. The idea, you know, is that the sentimental person thinks things will last—the romantic person has a desperate confidence that they won't.	Não sou sentimental — sou tão romântico como tu. A ideia, sabes, é que a pessoa sentimental pensa que as coisas vão durar — a pessoa romântica tem uma confiança desesperada de que não vão durar.
The one thing that a fish can never find is water; and the one thing that man can never find is God.	A única coisa que um peixe nunca consegue encontrar é água; e a única coisa que o homem nunca poderá encontrar é Deus.
Don't get that close to the fire.	Não te aproximes tanto do fogo.
The young man helps the elderly woman cross the street.	O jovem ajuda a senhora idosa a atravessar a rua.
Dania wanted to protect the guy that she loved.	A Dania queria proteger o rapaz que amava.
He exhaled a deep breath in discouragement.	Ele suspirou fundo de desalento.
It is an arid region, almost a desert.	É uma região árida, praticamente um deserto.
We'll see you at 2:30.	Vemo-nos às 2:30.
I brought you the wrong screwdriver.	Trouxe-te a chave de fendas errada.
For Serbia and Hungary, Russia's coronavirus vaccine Sputnik V has been a godsend, allowing both countries to accelerate their inoculation drives.	Para a Sérvia e a Hungria, a vacina russa contra o coronavírus Sputnik V tem sido uma bênção, permitindo a ambos os países acelerar as suas campanhas de vacinação.
I thought you'd be the last person to do such a thing.	Eu pensava que tu serias a última pessoa a fazer tal coisa.
I don't feel like doing anything today.	Hoje não me apetece fazer nada.
The study by the Australian National University's Centre for Aboriginal Economic Policy Research blames deep-seated racism and the lingering consequences of European colonization in 1788.	O estudo do Centro de Investigação em Política Económica Aborígene da Universidade Nacional Australiana atribui a culpa ao racismo profundamente enraizado e às consequências persistentes da colonização europeia de 1788.
I'll have my revenge.	Terei a minha vingança.
America's next National Security Advisor, Michael Flynn, said adversaries around the world are presenting challenges to the U.S. “at warp speed” and acknowledged that the prospects of assuming the position next week are daunting.	O próximo Conselheiro de Segurança Nacional dos EUA, Michael Flynn, afirmou que adversários em todo o mundo estão a colocar desafios aos EUA “à velocidade da luz” e reconheceu que a perspetiva de assumir o cargo na próxima semana é assustadora.
You know why I'm here today.	Vocês sabem porque é que estou aqui hoje.
This supermarket delivers only on Saturday.	Este supermercado só faz entregas aos sábados.
He broke his word, which made his wife angry.	Ele não manteve a sua promessa, o que deixou a esposa zangada.
I'm going to have to dye my hair.	Vou ter de pintar o cabelo.
Tom is going to want to read this.	O Tom vai querer ler isto.
Is Mary your girlfriend?	A Mary é a tua namorada?
Tom won't tell you.	O Tom não lhe vai contar.
I had to look after Tom for two hours this afternoon.	Tive de tomar conta do Tom durante duas horas esta tarde.
It almost brought me to tears.	Quase me levou às lágrimas.
I don't actually have any money.	Na verdade, não tenho dinheiro nenhum.
Tom has been helping me for quite a while.	O Tom tem-me ajudado há bastante tempo.
The skirt is long.	A saia é comprida.
Here we are at the station.	Aqui estamos, na estação.
You may stay here as long as you like.	Podes ficar aqui quanto quiseres.
This desk is used by me.	Esta carteira é usada por mim.
This is appalling.	Isto é horrível.
That may have been true many years ago.	Isso pode ter sido verdade há muitos anos.
Your advice is important for me.	O teu conselho é importante para mim.
I'm done making excuses.	Estou farto de dar desculpas.
You aren't as young as Tom.	Tu não és tão jovem quanto o Tom.
I'm not naked.	Não estou nu.
Numerous amputee and paraplegic veterans powered around the course solely on the strength of their arms and abs, riding a contraption aptly called a “sit-ski.”	Numerosos veteranos amputados e paraplégicos impulsionaram-se pela pista apenas com a força dos braços e abdominais, montados num aparelho apropriadamente chamado “sit-ski”.
Does this water taste bad?	Esta água tem mau gosto?
I was at a loss what to say next.	Eu não sabia o que dizer a seguir.
Tom tried to smile, but couldn't.	O Tom tentou sorrir, mas não conseguiu.
I didn't recognize Tom's parents.	Não reconheci os pais do Tom.
You missed the meeting.	Perdeste a reunião.
I didn't know that Tom had a girlfriend.	Eu não sabia que o Tom tinha namorada.
Their ship is still in port.	O navio delas ainda está no porto.
Mary helped Tom back to his feet.	A Mary ajudou o Tom a levantar-se.
When I opened my eyes again, all of a sudden an unknown lady was standing right in front of me.	Quando voltei a abrir os olhos, uma senhora desconhecida estava subitamente mesmo à minha frente.
I have Tom's key.	Tenho a chave do Tom.
I'm going to bed.	Estou a ir para a cama.
The problem here isn't Tom.	O problema aqui não é o Tom.
I tried to cheer him up.	Tentei animá-lo.
You must express yourself with your heart.	Deves exprimir-te com o coração.
It's a bad habit.	É um mau hábito.
Police spokeswoman McCormack said the exterior insulation on the ill-fated building failed safety tests meant to measure its flammability.	A porta-voz da polícia, McCormack, afirmou que o isolamento exterior do edifício desafortunado falhou nos testes de segurança destinados a avaliar a sua inflamabilidade.
I'm willing to talk.	Estou disposto a falar.
We were worried something had happened.	Temíamos que algo tivesse acontecido.
I have just written an SMS to Tom.	Acabei de enviar um SMS ao Tom.
I asked him for a favor.	Pedi-lhe um favor.
You don't want my money?	Tu não queres o meu dinheiro?
Can you tell me?	Podem dizer-me?
What I want is for everyone to be quiet.	O que eu quero é que todos fiquem calados.
Tom's bicycle was stolen yesterday.	A bicicleta do Tom foi roubada ontem.
In fact, he too loved her.	Na verdade, ele também a amava.
I still have many things to do.	Ainda tenho muitas coisas para fazer.
It's ridiculous.	É ridículo.
Is this your flight?	Este é o teu voo?
He accepted the job offer.	Ele aceitou a proposta de emprego.
Tom sat beside Mary.	O Tom sentou-se ao lado da Mary.
Go, give me.	Vai, dá-me.
I told Tom I knew what had happened.	Disse ao Tom que sabia o que tinha acontecido.
How much does Fadil owe you?	Quanto é que o Fadil lhe deve?
How do you do, Mrs. Jones?	Como está, Sra. Jones?
My grandfather used to drink beer on the weekends.	O meu avô costumava beber cerveja ao fim de semana.
Tom's English leaves much to be desired.	O inglês do Tom deixa muito a desejar.
It's rather odd.	É bastante estranho.
We'll make up for the loss.	Compensaremos a perda.
There's nothing like settling into a deckchair.	Não há nada como acomodar-se numa espreguiçadeira.
I will explain the problem to you later.	Explicar-te-ei o problema mais tarde.
Write in ink.	Escreve a tinta.
You speak my language.	Tu falas a minha língua.
Tom seems to be prepared.	O Tom parece estar preparado.
I'd love to hold you in my arms.	Adorava ter-te nos meus braços.
Tom still plays golf, doesn't he?	O Tom continua a jogar golfe, não continua?
I like the feasts in the village.	Gosto das festas na aldeia.
The hen sits on her eggs until they hatch.	A galinha senta-se sobre os ovos até que estes eclodam.
Is Tom here yet?	O Tom já chegou?
It is hard to get access to that place.	É difícil chegar a esse lugar.
Tom dug through his pockets looking for money.	O Tom remexeu nos bolsos à procura de dinheiro.
You don't owe me anything.	Não me deves nada.
How many students are there in your school?	Quantos estudantes há na tua escola?
Tom will meet Mary somewhere in Boston.	O Tom vai encontrar-se com a Mary algures em Boston.
I'm having a party tonight.	Vou dar uma festa esta noite.
Tom knows this area like the back of his hand.	O Tom conhece esta zona como a palma da mão.
I knew that my car had been stolen.	Soube que me tinham roubado o carro.
That was nothing.	Isso não foi nada.
I do not have what you are asking for.	Não tenho o que pedes.
My mother wants me to study in Switzerland.	A minha mãe quer que eu estude na Suíça.
South of Illyria and Macedonia lay northern Greece, comprising Epirus and Thessalia, separated from north to south by Mount Pindo.	A sul da Ilíria e da Macedónia encontrava-se a Grécia Setentrional, que incluía o Epiro e a Tessália, separados de norte a sul pelo monte Pindo.
I was up all night reading.	Passei a noite toda a ler.
However, I have no money.	Mas eu não tenho dinheiro.
The most important book to learn a foreign language is, naturally, a dictionary.	O livro mais importante para aprender um idioma é, naturalmente, um dicionário.
I might be able to help you find Tom.	Talvez consiga ajudar-te a encontrar o Tom.
I want you to have opportunities that I never had.	Quero que tenhas oportunidades que eu nunca tive.
Tom'll reconsider.	O Tom vai reconsiderar.
I don't think that anybody else noticed.	Não penso que mais ninguém tenha reparado.
The police found blood on the chair.	A polícia encontrou sangue na cadeira.
Tom has been all over Europe.	O Tom já esteve por toda a Europa.
There is a car in front of the church.	Há um carro à porta da igreja.
Fernando told me I can't swim.	O Fernando disse-me que não posso nadar.
October twentieth was Tom's birthday.	O aniversário do Tom foi a 20 de outubro.
You should go to school.	Deverias ir à escola.
I haven't had enough to drink yet.	Ainda não bebi o suficiente.
Fadil knew that Layla was engaged.	O Fadil sabia que a Layla estava noiva.
I'm afraid my opinion on the matter is different.	Receio que minha opinião sobre o assunto seja diferente.
Having heard it so many times, I can recite the poem by heart now.	Tendo-o ouvido tantas vezes, posso recitar o poema de cor agora.
A ghost is an outward and visible sign of an inward fear.	O fantasma é o sinal exterior e visível de um medo interior.
I have to write this report in French.	Tenho de escrever este relatório em francês.
It rained the entire trip.	Choveu durante toda a viagem.
He was ahead of his time.	Estava à frente do seu tempo.
I eat lunch here two or three times a week.	Almoço aqui duas ou três vezes por semana.
People were in disbelief — an economic collapse, worsened by the COVID-19 lockdown, then renewed tensions with Israel on the border, and now this.	As pessoas não acreditavam — um colapso económico agravado pelo confinamento da COVID-19, depois tensões renovadas com Israel na fronteira e agora isto.
The spokesman for Sudan's foreign ministry was fired Wednesday, a day after telling a media outlet that Sudan is getting ready to sign an agreement with Israel to normalize relations between the two countries.	O porta-voz do Ministério dos Negócios Estrangeiros do Sudão foi despedido na quarta-feira, um dia depois de ter dito a um órgão de comunicação social que o Sudão se prepara para assinar um acordo com Israel para normalizar relações.
He will travel abroad next year.	Ele viajará para o estrangeiro no próximo ano.
I don't think Tom knows why Mary isn't here today.	Não acho que o Tom saiba por que a Mary não está aqui hoje.
As restrictions on travel and other movement by citizens are eased in the Chinese city of Wuhan — once, the epicenter of the world-wide coronavirus outbreak — health officials say they must remain vigilant against a resurgence of the virus.	À medida que as restrições às viagens e deslocações na cidade chinesa de Wuhan — que foi epicentro do surto mundial de coronavírus — são levantadas, as autoridades de saúde dizem que devem manter-se vigilantes contra um ressurgimento do vírus.
Londoners heard the familiar chime of Big Ben at midnight, even though the famous clock is undergoing renovations and has been disconnected.	Os londrinos ouviram as badaladas familiares do Big Ben à meia-noite, apesar do famoso relógio estar em obras e ter sido desligado.
I majored in philosophy at my university.	Licenciei-me em Filosofia na universidade.
Fall is my favorite season.	O outono é a minha estação favorita.
Osgood was based back east in New York City, where he had bought an entire block, built a mansion on it, and become a cigar-smoking pal of other wealthy industrialists.	Osgood residia longe, na parte leste da cidade de Nova Iorque, onde ele comprara um quarteirão inteiro, construíra uma mansão nele e se tornara num fumador de charutos, amigaço de outros industrialistas ricos.
The human skull consists of 23 bones.	O crânio humano é constituído por 23 ossos.
The lawmakers had put aside 40,000 acres of land the previous year, and planned to earn enough money from it to endow the university.	Os legisladores tinham reservado 40 000 acres de terra no ano anterior e planeavam obter com ela fundos suficientes para dotar a universidade.
Sorry, but Mary's right.	Desculpa, mas a Mary tem razão.
I do not have any money to buy a new bicycle.	Não tenho dinheiro para comprar uma bicicleta nova.
Tom said he didn't have a choice.	O Tom disse que não tinha escolha.
The battle was over in minutes.	A batalha acabou em minutos.
I'll write a letter to Mary.	Escreverei uma carta à Mary.
This building is very old.	Este edifício é muito antigo.
Tom knew what he should do next.	O Tom sabia o que devia fazer a seguir.
Tom says he has never been to Boston.	O Tom diz que nunca esteve em Boston.
Did Ming's father play tennis yesterday?	O pai da Ming jogou ténis ontem?
Tom wanted to buy a house.	O Tom queria comprar uma casa.
Tom wants to return to Boston.	O Tom quer voltar a Boston.
Bush never wanted to harm anyone.	Bush nunca quis magoar ninguém.
Tom is a very fast swimmer.	O Tom é um nadador muito rápido.
We ran.	Corremos.
The mailman left a letter for her.	O carteiro deixou-lhe uma carta.
Where's my mom?	Onde está a minha mãe?
We like our school.	Gostamos da nossa escola.
My native language is Portuguese.	A minha língua materna é o Português.
I'd be willing to help you for a couple of hours.	Eu estaria disposto a ajudar-te durante umas horas.
If you agree to become an organ donor, you may help save someone's life.	Se aceitares tornar-te dador de órgãos, poderás ajudar a salvar a vida de alguém.
It snowed all night.	Nevou a noite inteira.
The unexpected by-product of the calculation was that Earth may be unique, actually an aberration among myriads of dead, uninhabitable worlds.	A consequência inesperada do cálculo foi que a Terra poderá ser única, uma aberração entre miríades de mundos mortos e inabitáveis.
Sami wrote his phone number on a note and gave it to Layla.	O Sami escreveu o número no telemóvel num bilhete e deu-o à Layla.
Keep your hands off my daughter!	Larga a minha filha!
She went to the museum by taxi.	Ela foi ao museu de táxi.
I am paying with this debit card.	Estou a pagar com este cartão de débito.
Among the 250 shark species that may be threatened by the fin trade are hammerheads, the plankton-eating basking shark and the spiny dogfish.	Entre as 250 espécies de tubarão potencialmente ameaçadas pelo comércio de barbatanas estão o tubarão-martelo, o tubarão-frade que se alimenta de plâncton e o cação-espinhoso.
Chile is not China.	O Chile não é a China.
What time does Tom usually get up?	A que horas o Tom costuma acordar?
You can't come any closer.	Não podes chegar mais perto.
I can't walk another step.	Não consigo dar nem mais um passo.
You can't park here, because there is a sign.	A senhora não pode estacionar aqui porque há um sinal.
The lecture was very long, but I enjoyed it none the less.	A palestra foi bastante longa mas mesmo assim eu gostei.
They theorized that the easily reversible adhesion of the gecko's footpads is not dependent solely on those microscopic hairs, but also on the unique internal anatomy of the lizard's foot.	Eles teorizaram que a aderência facilmente reversível das almofadas dos pés da calota não dependia apenas dos pelos microscópicos, mas também da anatomia interna única da pata do lagarto.
Let's sit on the bench.	Vamos sentar-nos no banco.
Today is October 11th.	Hoje é dia onze de outubro.
It's my turn now.	Agora é a minha vez.
I veered to the right.	Virei para a direita.
My flight arrived at 9 pm.	O meu voo chegou às 21h.
Tom will probably be the first one in our class to get married.	O Tom provavelmente será o primeiro da nossa turma a casar-se.
I've called the hospital.	Telefonei ao hospital.
If anything comes up that you don't understand, come to me.	Se aparecer alguma coisa que não entendas, vem ter comigo.
I wonder what happens around here on weekends.	Pergunto-me o que acontece por aqui aos fins-de-semana.
Hey, come back here.	Ei, volta aqui.
This piano is really cheap.	Este piano é mesmo barato.
Tom closed the venetian blinds, so the neighbors couldn't look in.	O Tom fechou as persianas para os vizinhos não poderem espreitar.
Tom was wearing the old jacket I'd given him.	O Tom estava com o casaco velho que eu lhe dera.
We have, literally, a pile of food to eat.	Temos, literalmente, um monte de comida para comer.
The investigators tried to identify the presence of drugs in the glass.	Os investigadores tentaram detectar a presença de drogas no copo.
I had nothing to do with them.	Eu não tinha nada a ver com eles.
Astronomers say that the comet, which made its closest approach to the Sun, or perihelion, on January 30, 2015, was also one of the most dazzling and active comets to pass us since comet Hale-Bopp in 1997.	Os astrónomos afirmam que o cometa, que alcançou o ponto mais próximo do Sol — o periélio — a 30 de janeiro de 2015, foi também um dos cometas mais deslumbrantes e ativos a passar por nós desde o Hale-Bopp em 1997.
Trees are living organisms.	As árvores são organismos vivos.
Why did you hide these flowers from me?	Porque é que me escondeste estas flores?
I want to thank you in advance for evaluating this article.	Quero agradecer-te antecipadamente por avaliares este artigo.
Tom thinks that he's tallest person here.	O Tom acha que é a pessoa mais alta daqui.
All the world is a stage, and all the men and women merely players. They have their exits and their entrances, and one man in his time plays many parts, his acts being seven ages.	O mundo inteiro é um palco, e todos os homens e mulheres são meros atores. Têm as suas saídas e as suas entradas, e cada homem, no seu tempo, representa muitos papéis; os seus atos são sete idades.
The news filled her with sorrow.	A notícia encheu-a de tristeza.
It's nice and cool today.	Hoje está agradável e fresco.
